Judul,Jenis,User Aktif
"40 Makanan Khas Daerah di Indonesia Beserta Asalnya Wajib Dicicipi ",Hot,2
"Fungsi Dendrit dan Akson pada Sistem Saraf Kenali Perbedaannya ",Hot,2
"6 Unsur Manajemen Pengertian dan Fungsinya yang Perlu Diketahui ",Hot,2
"Macam-Macam Syirik dan Contohnya dalam Islam yang Harus Dihindari ",Hot,2
"60 Kata-Kata Gombal Bikin Baper Buat PDKT yang Romantis dan Lucu ",Hot,2
"60 Kata-Kata Bijak Bahasa Inggris dan Artinya Tentang Kehidupan Penuh Inspirasi ",Hot,2
"15 Contoh Kata Kerja Mental dalam Kalimat Pahami Pengertiannya ",Hot,2
"15 Contoh Kata Kerja Mental dalam Kalimat Pahami Pengertiannya ",Hot,2
"50 Kata Kerja dalam Bahasa Inggris Lengkap dengan Contoh Kalimat ",Hot,2
"50 Kata Kerja dalam Bahasa Inggris Lengkap dengan Contoh Kalimat ",Hot,2
"50 Kata Kerja dalam Bahasa Inggris Lengkap dengan Contoh Kalimat ",Hot,2
"15 Pengertian Demokrasi Menurut Ahli Ketahui Hakikatnya ",Hot,2
"20 Macam Macam Konflik Lengkap Beserta Penjelasan dan Contohnya di Masyarakat ",Hot,2
"Tujuan Administrasi Pengertian Unsur Ciri-Ciri dan Fungsinya ",Hot,2
"Unsur Intrinsik Cerpen dan Ekstrinsik Lengkap Contoh dan Penjelasannya ",Hot,2
"257 Contoh Kata Serapan dari Berbagai Bahasa Pelajari dengan Benar ",Hot,2
"24 Macam-Macam Gaya Bahasa dan Contohnya Simak Penjelasan Ahli ",Hot,2
"Ciri-Ciri Hikayat Pengertian Unsur dan Jenisnya yang Perlu Diketahui ",Hot,2
"Jenis Alat Musik Berdasarkan Sumber Bunyinya Beserta Contohnya ",Hot,2
"Jenis Alat Musik Berdasarkan Sumber Bunyinya Beserta Contohnya ",Hot,2
"Cara Membuat Rumusan Masalah yang Baik dan Benar Perhatikan Langkah-langkahnya ",Hot,2
"550 Kata Sifat dalam Bahasa Inggris A-Z yang Sering Digunakan Dilengkapi Artinya ",Hot,2
"17 Tanda Hamil 1 Minggu yang Jarang Disadari oleh Wanita Mirip Gejala Menstruasi ",Hot,2
"15 Pengertian Musik Unsur Jenis-Jenis dan Fungsinya ",Hot,2
"15 Pengertian Musik Unsur Jenis-Jenis dan Fungsinya ",Hot,2
"Macam-Macam Sunnah dan Contohnya Penting dalam Hukum Islam ",Hot,2
"Unsur Intrinsik adalah Berasal dari Dalam Karya Sastra Lengkap Penjelasannya ",Hot,2
"Pengertian Syajaah dalam Islam Ketahui Jenis dan Manfaat Penerapannya ",Hot,2
"Pengertian Syajaah dalam Islam Ketahui Jenis dan Manfaat Penerapannya ",Hot,2
"50 Kata-Kata Romantis Ucapan Selamat Ulang Tahun Untuk Pacar yang Penuh Cinta ",Hot,2
"4 Tujuan Nasional Bangsa Indonesia yang Wajib Dipahami dari Perlindungan hingga Perdamaian ",Hot,2
"6 Macam-Macam Tawaf yang Dilakukan Jamaah Haji Ketahui Tata Caranya ",Hot,2
"Pengertian Motivasi Menurut Para Ahli dan Jenis-jenisnya yang Perlu Dikenali ",Hot,2
"Pengertian Motivasi Menurut Para Ahli dan Jenis-jenisnya yang Perlu Dikenali ",Hot,2
"15 Arti Mimpi Rumah Kebakaran sesuai Tafsirnya Pertanda Baik dan Buruk ",Hot,2
"125 Arti Bahasa Sunda dalam Kosakata Sehari-Hari Kenali Lebih Dalam ",Hot,2
"Kronologis adalah Urutan Kejadian Kenali Penggunaan dan Jenisnya ",Hot,2
"Arti Jazakallah Khairan Jazakillah dan Jazakumullah Beserta Jawabannya yang Benar ",Hot,2
"3 Cara Membuat Kompos dari Daun Kering yang Mudah Dilakukan ",Hot,2
"Pengertian Khutbah Syarat Rukun dan Tata Caranya dalam Islam ",Hot,2
"Pengertian Khutbah Syarat Rukun dan Tata Caranya dalam Islam ",Hot,2
"Geostrategi adalah Berwujud Ketahanan Nasional Pahami dari Sifat-Sifatnya ",Hot,2
"16 Arti Mimpi Buaya Sebagai Pertanda Baik atau Buruk Perhatikan Situasinya ",Hot,2
"15 Arti Mimpi Melihat Ular Besar Salah Satunya Tanda Harus Introspeksi ",Hot,2
"100 Arti Emoji WA Terbaru Pengguna WhatsApp Wajib Tahu ",Hot,2
"6 Arti Mimpi Bertemu Ayah yang Sudah Meninggal Pertanda Perlu Perbaiki Diri? ",Hot,2
"7 Penyebab Kebangkrutan VOC Korupsi sampai Utang ",Hot,2
"7 Arti Mimpi Melihat Hantu Bisa Jadi Pertanda Baik dan Buruk ",Hot,2
"7 Arti Mimpi Melihat Hantu Bisa Jadi Pertanda Baik dan Buruk ",Hot,2
"7 Arti Mimpi Melihat Hantu Bisa Jadi Pertanda Baik dan Buruk ",Hot,2
"Tanda Dinamika dalam Musik dan Perbedaannya dengan Tempo ",Hot,2
"7 Arti Mimpi Dapat Uang Bisa Jadi Pertanda Baik dalam Hidup ",Hot,2
"15 Tahun Berlalu Ini Potret Terbaru 6 Pemain Sinetron Doo Bee Doo ",Hot,2
"Gerak Manipulatif adalah Gerakan Menirukan Suatu Kegiatan dalam Olahraga ",Hot,2
"11 Penyebab Tangan Kesemutan Saat Bangun Tidur Gejala dan Cara Mengatasinya ",Hot,2
"Arti Kata Healing dalam Bahasa Gaul dan Cara Melakukannya ",Hot,2
"Siddiq Artinya Jujur Ketahui Ciri-Ciri dan Cara Meneladaninya dalam Islam ",Hot,2
"1 Ons Berapa Gram? Ketahui Konversi dan Cara Menghitungnya ",Hot,2
"Doa Tahiyat Awal dan Akhir Versi NU dan Muhammadiyah ",Hot,2
"Al Jami Artinya Yang Maha Mengumpulkan Ketahui Kisah dan Cara Meneladaninya ",Hot,2
"Entrepreneurship Adalah Kewirausahaan Pahami Manfaat dan Tahapannya ",Hot,2
"60 Kata Mutiara Islami Tentang Kehidupan Sehari-Hari Tingkatkan Keimanan ",Hot,2
"Pengertian Sketsa adalah Gambar Rancangan Sederhana Begini Cara Membuatnya ",Hot,2
"Al Wakil Artinya Maha Mewakili Pahami Makna dan Cara Meneladaninya ",Hot,2
"6 Arti Mimpi Tentang Pacar Pertanda Berjodoh? ",Hot,2
"10 Arti Mimpi Hewan Bisa Jadi Pertanda Baik hingga Buruk ",Hot,2
"6 Faktor Internal Penyebab Pelanggaran HAM di Indonesia Lengkap Penjelasannya ",Hot,2
"Yaumul Hisab Artinya Hari Perhitungan Amal Ketahui Tahapan Hari Kiamat ",Hot,2
"Cara Memasukan Voucher Telkomsel dengan Mudah dan Cepat Anti Ribet ",Hot,2
"4 Penyebab Perang Dingin Ketegangan AS dan Uni Soviet Pasca PD II ",Hot,2
"4 Penyebab Perang Dingin Ketegangan AS dan Uni Soviet Pasca PD II ",Hot,2
"Tujuan Pembentukan PPKI Lanjutkan Tugas BPUPKI dan Resmikan UUD ",Hot,2
"6 Penyebab Runtuhnya Uni Soviet Menurut Sejarah Ketahui Lebih Dalam ",Hot,2
"Properti Tari Adalah Peralatan untuk Pertunjukan Tari Ketahui Fungsi dan Contohnya ",Hot,2
"7 Arti Mimpi Ayam Bisa Jadi Pertanda Mendapat Keberuntungan ",Hot,2
"16 Artis FTV SCTV Wanita yang Sering Muncul di Layar Kaca Sudah Bintangi Puluhan Film ",Hot,2
"Contoh Mad Thabi'i dalam Alquran Pahami Pengertian dan Cara Bacanya ",Hot,2
"Contoh Review Jurnal yang Benar Lengkap dengan Cara Membuatnya ",Hot,2
"Contoh Sumber Daya Alam yang Tidak Dapat Diperbaharui Adalah Bahan Bakar Fosil ",Hot,2
"4 Contoh Teks Hasil Laporan Observasi yang Singkat Lengkap Strukturnya ",Hot,2
"6 Potret Penampilan Abidzar Saat Umroh Jadi Sorotan Ini Nasehat Umi Pipik ",Hot,2
"Kini Gondrong dan Pakai Tindik Ini 6 Potret Transformasi Abidzar Al Ghifari dari Kecil ",Hot,2
"Denda-Denda yang Harus Dibayarkan saat Melanggar Wajib Haji ",Islami,2
"Susunan Doa dan Bacaan Wirid Setelah Sholat Fardu ",Islami,2
"Dalil Tentang Zakat Fitrah Ketahui Hukum dan Keutamaannya ",Islami,2
"Doa Terbebas dari Utang yang Diajarkan Rasulullah SAW ",Islami,2
"Tata Cara Sholat Tasbih Serta Doa yang Dibaca 300 Kali ",Islami,2
"Bacaan Niat dan Tata Cara Sholat Hajat Beserta Doanya Insya Allah Makbul ",Islami,2
"Doa Saat Naik Kendaraan Darat Laut dan Udara Lengkap Arab hingga Artinya ",Islami,2
"Skenario dan Daftar Tim Negara Islam yang Berpotensi Lolos 16 Besar Piala Dunia 2022 ",Islami,2
"6 Kebiasaan yang Dapat Merusak Kehidupan Anda ",Lifestyle,2
"Stereotipe Negatif Pemimpin Perempuan di Dunia Bisnis Masih Jadi Pekerjaan Rumah ",Lifestyle,2
"Instagram vs Realita Bali Diungkap Turis Australia: Jangan Tertipu ",Lifestyle,2
"Niat Hati Liburan ke Bali Turis Jadi Terbang ke Bari Gegara Salah Beli Tiket Pesawat ",Lifestyle,2
"Niat Hati Liburan ke Bali Turis Jadi Terbang ke Bari Gegara Salah Beli Tiket Pesawat ",Lifestyle,2
"Berita Politik Hari Ini Nasional ",Kabar,2
"Pengacara Pembunuh Ade Sara: Putusan Kasasi MA Berlebihan ",News,2
"Ma'ruf Amin: Kemiskinan Bisa Buat Orang Jadi Kafir ",News,2
"Dekrit Presiden 5 Juli 1959 Mengakhiri Sistem Pemerintahan Liberal Indonesia ",News,2
"Dekrit Presiden 5 Juli 1959 Mengakhiri Sistem Pemerintahan Liberal Indonesia ",News,2
"Memahami Makna 99 Asmaul Husna Beserta Artinya ",News,2
"Tentang Median: Pengertian Rumus hingga Cara Menghitungnya ",News,2
"Bacaan Surat Al Maidah Ayat 48 Beserta Kandungan dan Artinya ",News,2
"‘Nyanyian’ Sambo dan Hendra Soal Ismail Bolong Bikin Kapolri Berang hingga Turun Tangan ",News,2
"Sambil Nangis Putri Candrawathi Cerita Skenario Pelecehan ke Anak Buah Ferdy Sambo ",News,2
"Pemerintah Hapus Pasal Pencemaran Nama Baik dan Penghinaan dalam UU ITE ",News,2
"Polri Klaim Sudah Tangkap Pelaku Tambang Ilegal Terkait Ismail Bolong ",News,2
"Ikan ke Darat Fenomena Alam atau Pertanda Bencana? ",News,2
"Viral Mobil Kecil Mirip Smart Fortwo Harga Rp 25 Juta ",Otomotif,2
"Segini Biaya Servis Honda Vario 160 di Tiga Tahun Pertama ",Otomotif,2
"10 Tempat Wisata Bandung Utara Menarik dengan Ragam Destinasi ",Hot,2
"Tujuan Reformasi Pengertian dan Penyebabnya yang Perlu Dipahami ",Hot,2
"Geostrategi adalah Berwujud Ketahanan Nasional Pahami dari Sifat-Sifatnya ",Hot,2
"Empati Adalah Sikap Memahami Perasaan Orang Lain Begini Cara Meningkatkannya ",Hot,2
"12 Faktor Penyebab Banjir yang Harus Diwaspadai Pahami Cara Mencegahnya ",Hot,2
"Gedung Bunder Cirebon Nasibmu Kini ",Regional,2
"Cerita Lagu Boneka Abdi Mendadak Populer sebagai Pemanggil Arwah ",Regional,2
"Pinyaram Si Manis Khas Ranah Minang untuk Jamuan Upacara Adat ",Regional,2
"5 Fakta di Balik Meninggalnya Irena Justine ",ShowBiz,2
"Baca Doa Ini Puluhan Malaikat Berebut Membawa Amal Anda ",ShowBiz,2
"Keluh Kesah Muzdalifah Sebelum Dilarikan ke Rumah Sakit: Sabar Saat Dianiaya Tak Membalas Kala Difitnah ",ShowBiz,2
"5 Tradisi Unik Suku Madura yang Masih Dilestarikan ",Surabaya,2
"Berita Australia Hari Ini ",Kabar,2
"Berita Banjir Hari Ini ",Kabar,2
"Berita Gunung Anak Krakatau Hari Ini ",Kabar,2
"Berita Helikopter Jatuh Hari Ini ",Kabar,2
"Berita Piala Dunia 2022 Hari Ini ",Kabar,2
"Berita Teks Editorial Hari Ini ",Kabar,2
"Ini 8 Penyebab Baterai Android Boros dan Cara Mengatasinya ",Tekno,2
"Fungsi Komputer Secara Umum Serta Manfaatnya Anak IT Wajib Tahu Nih ",Tekno,2
"Cara Mengetahui Password Tersimpan di Google Chrome ",Tekno,2
"Piala Dunia 2022: Jadwal Lengkap Hasil Klasemen dan Top Skor ",Bola,2
"Piala Dunia 2022: Jadwal Lengkap Hasil Klasemen dan Top Skor ",Bola,2
"Sukses Digitalisasi Farmasi Kemenperin Beri Sertifikat INDI 4.0 Bio Farma ",Bisnis,2
"Bocoran Tren Warna dan Potongan Rambut di 2023 Inspirasi Ganti Gaya di Tahun Baru ",Lifestyle,2
"Bacaan Doa Qunut Nazilah Lengkap Arab Latin dan Artinya ",Islami,2
"Menilik Potensi Pergerakan Pasar Kripto pada September 2022 ",Crypto,2
"Lengkap Harga BBM Terbaru Hari Ini di Seluruh Indonesia Usai Ada Kenaikan ",Bisnis,2
"Sholat Istikharah: Jumlah Rakaat Waktu dan Tata Caranya ",Islami,2
"Sholat Istikharah: Jumlah Rakaat Waktu dan Tata Caranya ",Islami,2
"Manfaat Sholat Istikharah Tata Cara Niat Doa dan Waktu Terbaik ",Regional,2
"Melihat Peran Penting Sulbar dalam Proses Pembangunan IKN ",Regional,2
"Meski Sudah Menurun Harga Bensin di AS Masih Mahal ",Bisnis,2
"Ukuran Lapangan Sepak Bola ",Bola,2
"Apa Itu Bansos PBI JK? Berikut Syarat dan Cara Ceknya ",Regional,2
"Perbandingan iPhone 13 Pro dan iPhone 14 Pro Perlu Upgrade? ",Tekno,2
"Lagu Wajib Kota Depok Tuai Polemik ",News,1
"7 Arti Mimpi Melahirkan Anak Perempuan Jadi Pertanda Baik ",Hot,1
"6 Fakta Menarik Wales Asal Nama Gelar Baru Pangeran William dan Kate Middleton ",Lifestyle,1
"Total Harta Member NCT 127 Siapakah yang Paling Kaya? ",Bisnis,1
"Garuda Indonesia Tawarkan Paket Umrah 4 Hari Harga Mulai Rp 24 Jutaan ",Bisnis,1
"Kenali Sejarah Tujuan dan Peraturan Dasar dalam Permainan Sepak Bola ",Bola,1
"Kenali Sejarah Tujuan dan Peraturan Dasar dalam Permainan Sepak Bola ",Bola,1
"Baca Surah Ini Ketika Sholat Dhuha UAH Ungkap Fakta Menakjubkan ",Islami,1
"Bacaan Sayyidul Istighfar Arab Latin dan Artinya: Baca Pagi dan Sore Keutamaannya Jadi Penghuni Surga ",Islami,1
"Bacaan Sayyidul Istighfar Arab Latin dan Artinya: Baca Pagi dan Sore Keutamaannya Jadi Penghuni Surga ",Islami,1
"Pelayaran Antar Pelabuhan Ketapang-Gilimanuk Terancam Berkurang Ini Gara-garanya ",Bisnis,1
"Kronologi Ledakan di Asrama Brimob Sukoharjo ",News,1
"Kenali Perbedaan Shuttle Travel dan Bus Pariwisata dalam Layanan Transportasi ",Regional,1
"Rahasiakan Suami Ini 6 Potret Terbaru Permesta Dhyaz Hamil Anak Kedua ",Hot,1
"Kisah Kelahiran Nabi Muhammad SAW yang Bawa Berkah Bagi Keluarga Halimah Sa'diyah ",Islami,1
"Bolehkah Wudhu di Kamar Mandi Sekaligus Toilet atau WC? Ini Kata Buya Yahya ",Islami,1
"Berbagai Macam Strategi Menyerang di Permainan Sepak Bola Apa Saja? ",Bola,1
"5 Karakter Tersembunyi Cancer Zodiak Paling Sensitif ",Citizen6,1
"Terkait Tragedi Arema Ini 5 Cara Atasi Kerusuhan Penggemar Sepak Bola ",Global,1
"50 Nama Bayi Laki-Laki Islami 2 dan 3 Kata Penuh Makna Cocok untuk si Buah Hati yang Baru Lahir ",Islami,1
"50 Nama Bayi Laki-Laki Islami 2 dan 3 Kata Penuh Makna Cocok untuk si Buah Hati yang Baru Lahir ",Islami,1
"4 Sifat Wajib Rasul dan Dalilnya yang Patut Diteladani oleh Umat Manusia ",Islami,1
"Begini Cara Pakai dan Isi Ulang Kartu JakLingko untuk Naik Angkot hingga MRT di Jakarta ",Lifestyle,1
"Syarat dan Cara Lamar Recruitment Pertamina 2022 Batch II Banyak Posisi Dibuka ",Bisnis,1
"Spesifikasi dan Harga Infinix Zero 20 HP Android Berkamera Depan 60MP Plus OIS ",Tekno,1
"Heboh Jutaan Ikan Loncat ke Daratan di Pantai Lampung Ini Beda Penjelasan BMKG dan Polairud ",Regional,1
"6 Potret Terbaru Azalia Bianda Mantan Kekasih Rizky Febian Makin Memesona ",Hot,1
"IQ Rata-Rata di 11 Negara Asia Tenggara Indonesia Nyaris Peringkat Terakhir ",Health,1
"Berharap Uang Kembali Korban Investasi Kripto Desak Pengungkapan Aset Pelaku ",Regional,1
"Rey Mbayang Siaga Menjaga Kehamilan Dinda Hauw Tak Ingin Keguguran Lagi ",ShowBiz,1
"Ketiban Untung 4 Negara Maju Hapus Utang Indonesia Rp 46 Triliun ",Bisnis,1
"Telkomsel Luncurkan Paket Halo Plus untuk Pelanggan Pascabayar ",Tekno,1
"Spider-Man 4 Versi Tom Holland Disebut Sedang Digarap dengan Munculkan Daredevil ",ShowBiz,1
"14 Prestasi Anies Baswedan Selama 5 Tahun Jadi Gubernur DKI Jakarta ",Citizen6,1
"Sinemart Perkenalkan Sinetron Rindu Bukan Rindu di Festival Jak-Japan Matsuri ",ShowBiz,1
"Mengenal Apa Itu DAO dalam Kripto ",Crypto,1
"10 Bau Ini Tanda Kedatangan Makhluk Halus? ",Citizen6,1
"Sejarah Masjid Istiqlal Proses Pembangunan Sampai 17 Tahun ",Regional,1
"Viral di Twitter Ini Penjelasan Fetish Human Toilet ",Citizen6,1
"Dangdut Academy 5: Eby Asal Bima Jadi Academia Terbaik Pertama di Babak Top 18 ",ShowBiz,1
"Tanggapan Menohok Islam Makhachev Saat Charles Oliveira Tantang Khabib Nurmagomedov ",Islami,1
"Cek Spesifikasi dan Harga HP OPPO Terbaru Mulai dari 1 Jutaan! ",Tekno,1
"8 Pertandingan Penyisihan Grup Piala Dunia 2022 yang Tak Boleh Dilewatkan ",Bola,1
"Pengakuan Via Vallen Keguguran: Ternyata Janinku Meninggal Sebulan yang Lalu ",ShowBiz,1
"Raih Gelar Doktor Hukum Meggy Tri Buana Dorong Perjanjian Perkawinan yang Pancasilais ",News,1
"6 Potret Lolly Anak Nikita Mirzani Si Sulung yang Jago Memanah dan Dikabarkan Pacaran dengan Putra Olla Ramlan ",ShowBiz,1
"Jam-Jam Aktif Organ Tubuh Manusia ",Citizen6,1
"4 Negara Terkecil di Dunia ",Citizen6,1
"Pemenang Miss Korea 2022 Dikritik karena Operasi Plastik Berlebihan Terlihat Seperti Manusia Virtual ",Lifestyle,1
"5 Drama Korea Season 2 yang Tayang di 2023 Bikin Gak Sabar ",Citizen6,1
"Top 3 News: Simak Jadwal Sidang Ferdy Sambo Cs hingga Kamis November 2022 ",News,1
"Harga BBM Pertamina Kembali Naik di 1 November 2022 Simak Rinciannya! ",Bisnis,1
"5 Potret Rumah Mewah Erina Gudono Calon Istri Kaesang Pangarep Bernuansa Putih ",Hot,1
"Sosok Kang Ha Neul Bintang Utama di Drama Korea Curtain Call ",Lifestyle,1
"Pesan Menyentuh Ganjar bikin Ribuan Wisudawan Universitas Pancasila Baper ",News,1
"Cara Membuat Akun PPPK Guru 2022 di Sscasn.bkn.go.id Wajib Saat Mendaftar ",Bisnis,1
"Cek 26 Titik Ganjil Genap Jakarta Rabu 2 November 2022 ",News,1
"6 Potret Kevin Sanjaya dan Valencia Tanoe di Paris Sedang Persiapkan Pernikahan ",Hot,1
"Bocoran Spesifikasi Samsung Galaxy S23 Ultra ",Tekno,1
"Alasan Jujur Femmy Permatasari Jalani Operasi Plastik Salah Satunya karena Kelebihan Duit ",Lifestyle,1
"Explore Instagram Dihujani Konten Porno? Ini Penjelasan Meta Indonesia ",Tekno,1
"iPhone 14 Pro Bakal Langka di Pasaran Kenapa? ",Tekno,1
"21 Negara Pernah jadi Tuan Rumah Piala Dunia Sebelum Qatar Cek di Sini ",Citizen6,1
"11 November 1918: Hari Gencatan Senjata Berakhirnya Perang Dunia I ",Global,1
"3 Produk Buatan Indonesia yang Tampil di Perhelatan Piala Dunia Apa Saja? ",Bola,1
"Resmi Cerai Ini 5 Momen Amanda Zahra Terciduk Nonton Konser LANY Bareng Marlo ",Hot,1
"Resmi Cerai Ini 5 Momen Amanda Zahra Terciduk Nonton Konser LANY Bareng Marlo ",Hot,1
"Terungkap 6 Penyebab Jatuhnya Pesawat Sriwijaya Air SJ 182 ",Bisnis,1
"Hujan Sejak Siang Kota Padang Dilanda Banjir ",Regional,1
"Harga Emas Antam Hari ini 13 November 2022 Ukuran 05 Gram hingga 1 Kg ",Bisnis,1
"KPK Sebut Joki Skripsi Adalah Bibit Perilaku Korupsi ",News,1
"Senegal Harapan Utama Afrika di Piala Dunia 2022 Qatar ",Bola,1
"Senegal Harapan Utama Afrika di Piala Dunia 2022 Qatar ",Bola,1
"Daftar Harga BBM Terbaru 15 November 2022 Ada yang Turun Lagi? ",Bisnis,1
"Menelusuri Rumah Keluarga Kalideres yang Tewas hingga Meninggalkan Bau Busuk ",News,1
"Produksi Hyundai Ioniq 5 Ditingkatkan Mulai Tahun Depan ",Otomotif,1
"8 Pertandingan Piala Dunia 2022 Tayang Eksklusif di Vidio Tidak Disiarkan di Televisi ",Bola,1
"5 Kakak Beradik yang Akan Tampil di Piala Dunia 2022 Qatar ",Bola,1
"Teks Materi Khutbah Jumat Singkat 2022: Hati-Hati dengan Istidraj Suatu Jebakan Kenikmatan ",Islami,1
"Cara Ajukan Sanggah Bagi Pelamar PPPK Guru 2022 Belum Lolos Seleksi Administrasi ",Bisnis,1
"Cedera Serius Sadio Mane Absen dari Piala Dunia Qatar 2022 ",Regional,1
"Begini Nasib 1.500 Mobil Listrik Usai Bertugas di KTT G20 ",Otomotif,1
"Apa Saja Lagu Soundtrack Resmi Piala Dunia 2022? ",Regional,1
"Jungkook BTS Cetak Banyak Sejarah Berkat Dreamers Soundtrack Piala Dunia 2022 ",Citizen6,1
"Dilantunkan di Pembukaan Piala Dunia Qatar 2022 Ini Arti Surah Al-Hujurat Ayat 13 ",Citizen6,1
"Pakai Rumus Matematika Pakar dari Universitas Oxford Prediksi Brasil Juara Piala Dunia 2022 ",Citizen6,1
"Lagu Piala Dunia 2022 Dreamers Milik Jungkook BTS Duduki Hampir Semua Chart iTunes Usai 12 Jam Rilis ",Citizen6,1
"Mengintip Harga Tiket Piala Dunia Qatar 2022 Laga Pembuka hingga Final ",Bisnis,1
"Apa Itu Ban Lengan One Love yang Tuai Kontroversi di Piala Dunia Qatar 2022? ",Lifestyle,1
"Sudah Main Link Live Streaming Piala Dunia 2022 Argentina vs Arab Saudi di Vidio ",Bola,1
"Ki Joko Bodo Meninggal Dunia di Usia 58 Tahun Ini 4 Faktanya ",Hot,1
"Daftar 5 Pemain Termuda Piala Dunia 2022 di Qatar ",Citizen6,1
"Mengenal Sosok Mohammed Al Owais Kiper Arab Saudi yang Berhasil Tangkis Gempuran Messi dkk ",Citizen6,1
"Daftar Harga Emas Hari Ini 23 November 2022 di Pegadaian ",Bisnis,1
"Berkas Lengkap 4 Tersangka Kasus Korupsi Waskita Beton Segera Disidang ",News,1
"Piala Dunia 2022: Jerman vs Jepang Der Panzer Melangkah Mulus? ",Regional,1
"Industri Hulu Migas Bergerak Bantu Korban Gempa Cianjur ",Bisnis,1
"Drakor Summer Strike Jadi Sorotan karena Visual dan Kedua Pemain Sayang Episodenya Cuma Sedikit ",ShowBiz,1
"Teks Khutbah Jumat Singkat Usai Gempa Cianjur: Musibah Introspeksi dan Cinta kepada Allah ",Islami,1
"Netflix Rilis Serial Wednesday Ini 4 Film yang Wajib Ditonton Terlebih Dahulu ",Citizen6,1
"Klasemen Piala Dunia 2022: Portugal Pimpin Grup H Ghana Paling Buncit ",Bola,1
"Alami Cedera Rongga Mata Alasan Son Heung Min Pakai Topeng Pelindung di Piala Dunia 2022 ",Health,1
"Berkenalan dengan Cho Gue Sung Pemain Timnas Korsel di Piala Dunia 2022 Qatar yang Memesona ",Citizen6,1
"Drama Jepang First Love Netflix Langsung Disorot Terinspirasi Lagu Fenomenal Milik Utada Hikaru ",ShowBiz,1
"Tak Seperti Ioniq 5 Wuling Air ev Bekas KTT G20 Ada Diskonnya ",Otomotif,1
"Pengumuman dari Erina Gudono: Saya dan Kaesang Pangarep Tidak Terbitkan Undangan Digital Bentuk Apa pun ",ShowBiz,1
"Heboh Maskawin Kaesang Pangarep untuk Erina Gudono Ketahui Arti dan Batasan Mahar dalam Islam ",Islami,1
"Dari Raffi Ahmad hingga Vincent Rompies Ini Tim Jagoan Para Artis di Piala Dunia 2022 ",Regional,1
"Opsi Pengganti Neymar untuk Brasil di Piala Dunia 2022 Ada Bintang MU ",Bola,1
"Opsi Pengganti Neymar untuk Brasil di Piala Dunia 2022 Ada Bintang MU ",Bola,1
"Klasemen Grup D Piala Dunia 2022: Bekuk Denmark Prancis Amankan Tiket 16 Besar ",Bola,1
"Daftar Tim yang Lolos 16 Besar Piala Dunia 2022: Belanda dan Inggris Belum Prancis Rebut Tiket Pertama ",Bola,1
"Daftar Tim yang Lolos 16 Besar Piala Dunia 2022: Belanda dan Inggris Belum Prancis Rebut Tiket Pertama ",Bola,1
"Klasemen Grup C Piala Dunia 2022 Usai Argentina vs Meksiko ",Bola,1
"9 Fakta Pablo Gavi Pemain Spanyol Berparas Tampan di Piala Dunia 2022 ",Citizen6,1
"Jadwal Pendaftaran Seleksi PPPK Ini Penjelasan Karopeg Setjen Kemenag ",Islami,1
"Peneliti Pakai Algoritma untuk Prediksi Juara Piala Dunia 2022 Siapa? ",Tekno,1
"Peneliti Pakai Algoritma untuk Prediksi Juara Piala Dunia 2022 Siapa? ",Tekno,1
"Menohok Alasan Kapten Portugal Cristiano Ronaldo dan Hugo Lloris Tolak Armband Pelangi LGBT ",Islami,1
"Banyak Predator Tampil Piala Dunia 2022 Masih Menunggu Hattrick ",Bola,1
"Son Ye Jin Melahirkan Anak Pertama Video Hyun Bin Ungkap Apa yang Akan Dibelikan untuk Putranya Curi Perhatian ",Lifestyle,1
"Penuh Foto Mesut Ozil di Laga Spanyol vs Jerman Piala Dunia 2022 Ada Apa? ",Citizen6,1
"Umat Katolik dan Kristen Telah Memasuki Masa Adven Sebelum Natal Apa Itu? ",Citizen6,1
"Profil Singkat Kapolres Cianjur AKBP Doni yang Trending di Media Sosial Twitter ",Regional,1
"Profil Singkat Kapolres Cianjur AKBP Doni yang Trending di Media Sosial Twitter ",Regional,1
"Nikita Mirzani Tampil Memesona di Sidang Lanjutan Sempat Kena Tegur Hakim karena Tak Pakai Masker ",ShowBiz,1
"Son Ye Jin Melahirkan Lebih Cepat Hyun Bin Dikabarkan Belum Bertemu Bayinya karena Syuting di Mongolia ",ShowBiz,1
"Raib dari Play Store APK Sigma Battle Royale Mirip Free Fire Banyak Diburu Warganet ",Tekno,1
"Son Ye Jin Melahirkan Bayi Laki-Laki Ini Cita-Cita Hyun Bin Saat Jadi Ayah ",Health,1
"Kanada Tersingkir dari Piala Dunia 2022 Jonathan David Curi Perhatian: Pernah Tolak AS ",Bola,1
"Profil Hakim Ziyech Bintang Muslim Chelsea Pernah Bela Belanda Lantas Timnas Maroko Demi Ibu ",Islami,1
"Selain Weak Hero Class 1 Berikut 3 Drakor Populer Dibintangi Park Ji Hoon ",Citizen6,1
"Selain Weak Hero Class 1 Berikut 3 Drakor Populer Dibintangi Park Ji Hoon ",Citizen6,1
"5 Fakta Unik Maskot Piala Dunia Qatar Salah Satunya Disebut Mirip Casper ",Regional,1
"Update Banjir Jakarta BPBD DKI: 6 Ruas Jalan dan 19 RT Tergenang 1 Korban Jiwa ",News,1
"Sadar Dibohongi Hendra Kurniawan ke Agus Nurpatria: Kita Dikadalin Ferdy Sambo ",News,1
"Kabar Gembira untuk Warga Medan per 1 Desember 2022 Berobat ke RS Hanya Pakai KTP ",Regional,1
"Prediksi Susunan Pemain Ekuador vs Senegal di Grup A Piala Dunia 2022 ",Bola,1
"Heboh Pencopotan Label Gereja di Tenda Bantuan Gempa Cianjur Ini Pesan Adem Buya Yahya ",Islami,1
"Dapat Kartu Merah Pelatih Korea Selatan Gagal Bertemu Negara Asalnya di Laga Akhir Grup Piala Dunia ",Bola,1
"Bukan Ronaldo Ini Sosok Man of the Match Piala Dunia 2022 Portugal vs Uruguay ",Bola,1
"Peneliti UGM Klaim Temukan Gejala Sebelum Gempa Cianjur Magnitudo 56 ",Regional,1
"Tak Disiarkan di Televisi 8 Pertandingan Piala Dunia 2022 Ini Tayang Eksklusif di Vidio ",Bola,1
"Lengkap Daftar UMP 2023 di 31 Provinsi di Indonesia ",Bisnis,1
"Naik 78 Persen UMP Jatim 2023 Diketok Senilai Rp 2.040.244 ",Surabaya,1
"Tonton Sinetron Cinta Setelah Cinta Episode Selasa 29 November 2022 Malam Via Live Streaming SCTV di Sini ",ShowBiz,1
"Amerika Serikat Dukung Demonstrasi Warga China Tolak Lockdown COVID-19 ",Global,1
"Harga Minyak Dunia Bangkit Kembali Usai Beredar Rumor OPEC Pangkas Produksi ",Bisnis,1
"UMP Jawa Barat 2023 Naik 788 Persen Ini Dasar Hitungannya ",Bisnis,1
"Menikah Lagi di Usia 48 Tahun Ini 7 Potret Transformasi Teddy Syach dari Remaja ",Hot,1
"SPOTLIGHT Indonesia 2022 Keroyokan Memberdayakan Desainer dan Brand Fesyen Lokal ",Lifestyle,1
"Tanggapan Balenciaga atas Iklan Kontroversial yang Ramai Dikecam Publik ",Regional,1
"Presiden dan Seluruh Dewan Juventus Hengkang Berjemaah Ada Apa? ",Citizen6,1
"Syarat Lolos 16 Besar Piala Dunia 2022 dari Grup C: Argentina Belum Aman Meksiko Punya Peluang ",Bola,1
"Syarat Lolos 16 Besar Piala Dunia 2022 dari Grup C: Argentina Belum Aman Meksiko Punya Peluang ",Bola,1
"5 Potret Mayang Lucyana Adik Vanessa Angel Disebut Habis Operasi Plastik Doddy Sudrajat Ucap Syukur: Alhamdulillah Hidungnya Mulai Tinggi ",ShowBiz,1
"Motif Batik Kawung Yogyakarta Kini Ada di Travel Diffuser Nirkabel ",Lifestyle,1
"Profil KSAL Yudo Margono Calon Tunggal Panglima TNI Pilihan Jokowi ",News,1
"3 Bintang Muda Sepak Bola dengan Bayaran Termahal di Piala Dunia 2022 ",Citizen6,1
"3 Bintang Muda Sepak Bola dengan Bayaran Termahal di Piala Dunia 2022 ",Citizen6,1
"Chuu Melawan Balik Tudingan BlockBerryCreative Agensi Loona yang Mendepaknya atas Tuduhan Arogan ",ShowBiz,1
"Gol Pertama Portugal vs Uruguay Ronaldo atau Fernandes? Ini Faktanya! ",Regional,1
"Brokoli hingga Bawang Putih 5 Makanan Ini Memberikan Banyak Manfaat untuk Tubuh ",Citizen6,1
"Terkuak Identitas Pengibar Bendera Pelangi di Piala Dunia 2022 ",Global,1
"Update Covid-19 Selasa 29 November 2022: Positif 6.659.235 Sembuh 6.441.327 Meninggal 159.789 ",News,1
"Mengenal Dr. Cool Sosok di Balik Teknologi AC Raksasa dalam Stadion Piala Dunia 2022 Qatar ",Tekno,1
"Moon Sang Min Iri Tak Ada Dirinya di Potret Unggahan Oh Ye Ju Bareng 3 Pemain Under The Queen's Umbrella ",ShowBiz,1
"Protes Anti-Lockdown COVID-19 Meluas di China Polisi Kepung Beijing dan Shanghai ",Global,1
"Biznet Down Seharian Pengguna Luapkan Kemarahan di Twitter ",Tekno,1
"Biznet Down Seharian Pengguna Luapkan Kemarahan di Twitter ",Tekno,1
"Terjebak Hoaks Petinju Canelo Alvarez Tuduh Messi Ngepel dengan Bendera Meksiko ",Global,1
"5 Bintang Piala Dunia dengan Follower Terbanyak di Medsos Ada Favoritmu? ",Citizen6,1
"Gempa Hari Ini Selasa 29 November 2022 Getarkan 4 Wilayah Indonesia ",News,1
