Judul,Jenis,User Aktif
Penyebab Wanita Gagal Raih Orgasme Saat Bercinta Salah Satunya Kurang Stimulasi,Health,9
6 Potret Perayaan Ulang Tahun Okie Agustina ke-40 Riasannya Bikin Pangling,Hot,7
Bacaan Doa Setelah Sholat Tahajud Rasulullah SAW Arab Latin dan Artinya,Islami,7
Ternyata Pihak-Pihak Ini yang Disebut Punya Bitcoin Terbanyak di Dunia,Crypto,6
Rekomendasi Film-Film Seru di Bioskop Sepanjang September 2022 Cek Tanggal Tayangnya,Regional,6
Manfaat Sholat Istikharah Tata Cara Niat Doa dan Waktu Terbaik,Regional,6
Pertama Populasi Islam di Inggris Tembus 3 Juta Orang pada Masa Ratu Elizabeth II,Islami,5
Jung Chaeyeon Cedera Saat Syuting Golden Spoon Patah Tulang Selangka dan Ada Gejala Gegar Otak,ShowBiz,5
Wajah Istri Sultan Kelantan yang Pernah Bersengketa dengan Miss Moscow Terlihat untuk Pertama Kali,Lifestyle,5
Nonton Video Porno Bareng Pasangan Beri Dampak Positif atau Justru Negatif?,Health,5
4 Pelaku Pemerkosaan Remaja 13 Tahun di Hutan Kota Jakut Ternyata Anak di Bawah Umur,News,5
Polisi Usut Kasus Bocah 12 Tahun di Medan Jadi Korban Pelecehan Periksa 8 Saksi,Regional,4
Cara Ubah Tampilan Notifikasi iPhone di iOS 16 Agar Lebih Mudah Dibaca,Tekno,4
2 Kasus Razman Arif Nasution Naik ke Level Penyidikan Dugaan Ijazah Palsu dan Pencemaran Nama Baik,ShowBiz,4
Prediksi Algoritma Piala Dunia 2022 Setuju Argentina Juaranya?,Bola,4
Sinopsis Rise Of The Planet Of The Apes Tayang Malam Ini di TV Petaka Uji Coba Obat Alzheimer yang Meningkatkan Kecerdasan Simpanse,ShowBiz,4
Skintific Meluncurkan Produk Cushion dengan Kandungan Serum Setelah Banyak Skincare yang Ampuh dan Laris,ShowBiz,4
Sudah Dilarang FIFA PSSI Ungkap Alasan Pihak Keamanan Menembakkan Gas Air Mata di Tragedi Kanjuruhan,Bola,4
Doa Agar Diberi Keturunan Anak Laki-Laki,Islami,4
Cuek dengan Isu Perselingkuhan Behati Prinsloo Tertangkap Kamera Temani Adam Levine Manggung,Health,4
Prediksi Dolar AS Bakal Anjlok pada 2023 Penulis Ini Lihat Peluang Bitcoin,Crypto,4
Catat Jam Operasi dan 26 Titik Ganjil Genap Jakarta Hari Ini Jumat 7 Oktober 2022,News,4
Kenalan dengan Token Kripto Kaspa Coin,Crypto,4
Skrining Hormon Tiroid pada Bayi Baru Lahir Bisa Cegah Gangguan Tumbuh Kembang Anak,Health,4
Top 3: Unggahan Ayah Tegar Sinar Ramadhan Mahasiswa UGM yang Meninggal Jadi Sorotan Netizen,Citizen6,3
IQ Rata-Rata di 11 Negara Asia Tenggara Indonesia Nyaris Peringkat Terakhir,Health,3
5 Dampak Buruk Keseringan Onani,Citizen6,3
Ini Sosok Dilan Cepmek Viral di TikTok hingga Twitter,Citizen6,3
Sinopsis Mr. Harrigan's Phone Kejadian Misterius yang Dialami Remaja Usai Menyelipkan Ponsel ke dalam Peti Mati Seorang Kakek,ShowBiz,3
Bacaan Doa Panjang Umur Peroleh Limpahan Berkah untuk Diri Sendiri dan Orang Lain,Islami,3
3 Kandidat Penyanyi di Upacara Pembukaan Piala Dunia 2022 Ada Shakira dan BTS,Bola,3
Cara Beli Paket Langganan Disney+ Hotstar Setahun Rp 69 Ribu via Grab,Tekno,3
INFJ hingga ENTP Ini 5 Tipe Kepribadian Paling Langka,Citizen6,3
Dibayangi Resesi Harga Emas Bakal Melambung di 2023?,Bisnis,3
Kim Sejeong Ahn Hyo Seop dan Chicco Jerikho Adu Akting dalam Mini Content Terbaru,Citizen6,3
Sederet Idol Kpop Bakal Manggung di Indonesia hingga 2023 Mendatang Catat Waktunya!,Citizen6,3
Skuad Timnas Inggris di Piala Dunia 2022 Segera Diumumkan Siapa Bakal Terpilih?,Bola,3
Panduan Cara Menggelar Nobar Piala Dunia 2022 dan Liga Inggris,Bola,3
Bocah SD Ditusuk Usai Pulang Mengaji Keluarga Sebut Tak Punya Masalah dengan Siapa pun,Regional,3
Libra hingga Taurus 4 Zodiak Ini Jadi yang Paling Beruntung di Tahun 2023,Citizen6,3
Wisatawan Indonesia Bisa Kunjungi Korea Selatan Bebas Visa tapi...,Lifestyle,3
Drakor Populer One Dollar Lawyer Akan Tamat di Episode ke-12 Penonton Kecewa,ShowBiz,3
6 Potret Terbaru Artis Cilik Nizam di Buku Harian Baim Disebut Mirip Jerome Polin,Hot,3
Erep-Erep atau Ketindihan Saat Tidur Benarkah karena Gangguan Makhluk Halus?,Islami,3
4 Fakta Unik Film Perfect Strangers Bikin Penasaran!,Citizen6,3
Kemnaker Targetkan BSU Cair 100 Persen di November 2022,Bisnis,3
Ramalan Zodiak November Ini Cek Tanggal Keberuntunganmu,Regional,3
Indonesia Resmi Jadi Negara Ekonomi Terbesar ke-7 Dunia Salip Inggris,Bisnis,3
Kronologi Itaewon Berubah Jadi Pusat Tragedi Halloween,Lifestyle,3
Kronologi Tragedi Halloween Itaewon yang Sebabkan Ratusan Korban Jiwa,Health,3
Cara Setting STB TV Digital Gampang dan Enggak Ribet,Tekno,2
Dugaan Kesaksian Palsu ART Sambo dan Kecurigaan Jaksa Soal Penggunaan Earphone,News,2
Mau Beli Logam Mulia? Cek Harga Emas Pegadaian di Awal November 2022,Bisnis,2
Terbaru Mulan Jameela Ini 6 Artis Indonesia yang Meraih Gelar Sarjana di Usia 40 Tahun ke Atas,ShowBiz,2
Sinopsis Drama 'Curtain Call' Kisah Kang Haneul Menjadi Pembelot Korut,Regional,2
Cara Pindah dari TV Analog ke TV Digital,Tekno,2
Lee Jihan Disebut Meninggal Saat Selamatkan Gadis Kecil di Tragedi Halloween Itaewon,Citizen6,2
Orasi di Wisuda Universitas Pancasila Ganjar Yakin Indonesia Jadi Negara Maju,News,2
Cara Membuat Akun PPPK Guru 2022 di Sscasn.bkn.go.id Wajib Saat Mendaftar,Bisnis,2
Guardiola Yakin Walker dan Kalvin Phillips Bisa Main di Piala Dunia Tapi Terserah Inggris,Bola,2
Ibu dan 2 Anaknya Terlibat Kecelakaan Maut di Katingan,Regional,2
Lesti Kejora Dikabarkan Hamil Anak Kedua Ini 6 Potretnya Bareng Rizky Billar,Hot,2
Apakah TV Tabung Bisa untuk Nonton Siaran TV Digital?,Tekno,2
Sinopsis Armour Of God Tayang Malam Ini di Indosiar Jackie Chan Jadi Pemburu Harta Karun yang Diteror Sekte Sesat,ShowBiz,2
HEADLINE: ASO Alihkan Siaran TV Analog ke TV Digital Apa Perbedaan Keunggulan dan Manfaatnya?,Tekno,2
Infinix Hot 20S Meluncur Harga Rp 2 Jutaan,Tekno,2
Tidak Semua TV LED Merupakan TV Digital Ini Ciri-cirinya,Tekno,2
Tidak Semua TV LED Merupakan TV Digital Ini Ciri-cirinya,Tekno,2
5 Update Tentang Avatar 2 The Way of Water dari Sinopsis hingga Jadwal Rilis serta Durasi yang Disebut Lebih dari 3 Jam,ShowBiz,2
Cek Dulu Lewat Pospay Begini Cara Cairkan BSU Tahap 7 Lewat Pos Indonesia,Bisnis,2
Cara Daftar Akun SSCASN BKN buat Daftar Lowongan PPPK Guru 2022,Bisnis,2
Warganet Pertanyakan Masih Ada Stasiun TV Swasta Siarkan TV Analog,Tekno,2
Siarkan Seluruh Pertandingan NEX Parabola Pemegang Hak Siar Tunggal Piala Dunia 2022 di TV Satelit,Bola,2
Link Video Mesum Wanita Kebaya Merah Jadi Buruan Ini Hukum Menonton Video Porno,Islami,2
Kapan Pendaftaran PPPK Teknis 2022 Dibuka Inikah Jadwalnya?,Bisnis,2
Harga Minyak Dunia Mengucur Turun 2 Persen Imbas Kebijakan China dan Amerika,Bisnis,2
Kisah Hidup Bunda Corla di Jerman Disorot Media Deutsche Welle,Global,2
Bocoran Spesifikasi Samsung Galaxy S23 Ultra,Tekno,2
Bocoran Spesifikasi Samsung Galaxy S23 Ultra,Tekno,2
5 Potret NCT 127 di Bandara Jelang Konser Neo City: Jakarta - The Link Lepas Jaket Setelah Tiba di Indonesia,ShowBiz,2
Kominfo: Pembagian Set Top Box Gratis di Jabodetabek Capai 993 Persen,Tekno,2
Layani BSU 2022 Kantor Pos Indonesia Buka Senin-Minggu hingga Pukul 20.00 WIB,Bisnis,2
Kisah Pilu Bunda Corla Salat Tahajud Sambil Nangis Minta Kerjaan Ke Tuhan Setelah Menjanda di Jerman,ShowBiz,2
Link Download Google Play Games PC Beta Main Game Android Tanpa Emulator,Tekno,2
Nagita Slavina dan RANS Trending Usai Disebut Beli Jersey Palsu untuk Cipung Akun JerseyForum Langsung Minta Maaf,ShowBiz,2
Kenalan dengan GALA Coin Token Kripto Utilitas Ekosistem Gala Games,Crypto,2
Prediksi AC Milan vs Spezia di Liga Italia: Bukan Lawan Mudah,Bola,2
Banyak Penonton Pingsan Konser NCT 127 di Tangerang Selatan Terpaksa Dibubarkan,ShowBiz,2
Harga Emas Dunia Hari Ini Meroket 3 Persen Ini Pemicunya,Bisnis,2
Polisi Federal Australia Temukan Kejahatan Kripto Kian Bertambah,Crypto,2
Survei CNN: Pelaku Usaha Indonesia Ingin Airlangga Capres 2024,News,2
Debut di Usia Belia Ini Potret 15 Idol Kpop yang Kini jadi Bintang Top,Citizen6,2
6 Momen Romantis Thoriq Halilintar Beri Cicin ke Fuji Jadi Lambang Keseriusan,Hot,2
Sering Merasa Lelah Walau Sudah Tidur 8 Jam? Ternyata Ini Penyebabnya,Global,2
Parade Surabaya Juang 2022 Digelar Besok Cek Rekayasa Lalu Lintasnya,Surabaya,2
Enola Holmes 2 Resmi Tayang Misi Pencarian Sarah Chapman Dimulai,Citizen6,2
Rekam Jejak Fallincy Mbak Topi Subak Musuh Bersama Fans NCT 127 dan Kpopers,Citizen6,2
Rekam Jejak Fallincy Mbak Topi Subak Musuh Bersama Fans NCT 127 dan Kpopers,Citizen6,2
Rekam Jejak Fallincy Mbak Topi Subak Musuh Bersama Fans NCT 127 dan Kpopers,Citizen6,2
Sehun EXO Ternyata Pernah Emoh Menyapa Fans Setia Gara-Gara Apa?,Citizen6,2
Jadwal Lengkap Sidang Ferdy Sambo Cs Pekan Depan,News,2
Saksikan Mega Series Indosiar Panggilan Dibintangi Gita Sinaga dan Habibi Sabtu 5 November 2022 Malam Via Live Streaming Indosiar di Sini,ShowBiz,2
Saksikan Sinetron Cinta Setelah Cinta Sabtu 5 November 2022 Malam Via Live Streaming SCTV di Sini,ShowBiz,2
Sandiaga Uno Soal Pilpres 2024: Seperti Arahan Presiden Jangan Terburu-Buru,News,2
Hasil Hylo Open 2022: Hajar Unggulan 2 Rehan/Lisa Melangkah ke Final,Bola,2
9 Aktivitas Orang Sukses Satu Jam Pertama Sebelum Kerja,Bisnis,2
Harganya Rp 13 Triliun Inikah Kapal Pesiar Termahal?,Bisnis,2
Anak Usaha KAI Bangun Mal dan Hotel di Purwokerto,Bisnis,2
10 Negara Produsen Susu Terbesar di Dunia,Bisnis,2
10 Ikat Pinggang Termahal di Dunia Seperti Apa?,Bisnis,2
5 Strategi Pemasaran Biar Dagangan Laris Manis,Bisnis,2
Nestle Buka Lowongan Kerja Buruan Daftar!,Bisnis,2
Kisah Perjuangan Ibu di Balik Kesuksesan Orang Terkaya Dunia,Bisnis,2
3 Masalah Ketenagakerjaan di Freeport Indonesia,Bisnis,2
Macam Macam Pasar dan Contohnya Lengkap dengan Pengertiannya,Bisnis,2
Daftar Terbaru 100 Orang Terkaya Dunia versi Forbes Ada dari Indonesia,Bisnis,2
6 Merek Skincare yang Tak Mahal Sekaligus Aman Buat Ibu Hamil,Bisnis,2
8 Minuman Anggur Termahal di Dunia,Bisnis,2
INKA Ingin Inalum Pasok Bahan Baku Buat Badan Kereta,Bisnis,2
Ternyata Ini Alasan Air Pipa Tak Bisa Langsung Diminum,Bisnis,2
Ingin Tahu Anda Cocok Tidak Jadi Pengusaha? Kenali Tanda-Tandanya,Bisnis,2
Jawaban Tepat Saat Ditanya Alasan Pilih Melamar Kerja di Satu Perusahaan,Bisnis,2
Kilas Balik Dampak Pandemi Covid-19 ke Ekonomi Dunia dan Indonesia,Bisnis,2
Daftar PPPK pada Seleksi CPNS 2021 Tidak Bisa Pilih Instansi? Ini Penjelasan BKN,Bisnis,2
Ayo Daftar Dibuka 19 Posisi Lowongan Kerja di Rumah Sakit Ini,Bisnis,2
Pelanggan PGN Kini Bisa Sampaikan Aduan via Whatsapp Begini Caranya,Bisnis,2
Ketahui Ambang Batas Soal dan Bobot Nilai agar Lulus Seleksi Kompetensi PPPK Guru,Bisnis,2
Temukan Oknum Penyalur KUR yang Nakal? Laporkan ke Call Center Kemenkop UKM,Bisnis,2
HEADLINE: Tenaga Honorer Instansi Pemerintah Dihapus pada 2023 Efeknya?,Bisnis,2
Agen BRILink Fasilitasi Pengajuan Kredit Ultra Mikro yang Jadi Andalan Pelaku Usaha,Bisnis,2
Pengertian Ekspor dan 13 Komponen Biaya yang Harus Eksportir Ketahui Apa Saja?,Bisnis,2
BRImo Punya Fitur Transfer Internasional Tukar Valas hingga Transfer Uang Semakin Praktis,Bisnis,2
Erick Thohir Bakal Buka Lagi Lowongan Kerja Besar-Besaran di BUMN Akhir 2022,Bisnis,2
Erick Thohir Bakal Buka Lagi Lowongan Kerja Besar-Besaran di BUMN Akhir 2022,Bisnis,2
Ibu Hamil Bisa Dapat BLT PKH Rp 3 Juta Gimana Caranya?,Bisnis,2
Daftar 7 Investasi Bodong yang Disetop SWI Awas Tertipu!,Bisnis,2
Begini Cara Mengurus Perubahan Identitas Diri di KK KTP hingga Akta,Bisnis,2
OJK Punya Aturan Baru Pinjol Bakal Naik Kelas,Bisnis,2
Ini 10 Produsen Gas Terbesar di Indonesia,Bisnis,2
OJK Bongkar Tantangan Pengembangan BPR Mulai dari Modal hingga SDM,Bisnis,2
IKN Nusantara Sudah Mulai Dibangun Ini Daftar Proyeknya,Bisnis,2
Cara Membubuhkan Meterai Elektronik Saat Daftar Seleksi PPPK 2022 Disimak Nih!,Bisnis,2
HEADLINE: Mengerek Tarif Cukai Rokok Naik 10 Persen di 2023 hingga 2024 Efektif Tekan Jumlah Perokok?,Bisnis,2
Jaga Ketahanan Energi Nasional Pertamina Agresif Bor Sumur,Bisnis,2
Harga Emas Antam Hari Ini Menggila Naik Rp 15.000 per Gram,Bisnis,2
Sudah Berdiri Sekolah KAI Minta Eksekusi Aset di Bandung Ditunda,Bisnis,2
Bisnis Asuransi Jiwa Bakal Booming di 2023,Bisnis,2
Citilink Terima Airbus A320 Terbaru ke-23,Bisnis,2
6 Alasan Lebih Baik Meniti Karir di Perusahaan Besar,Bisnis,2
5 Sifat Egois Pemain yang Jadi Momok Keharmonisan Tim Sepak Bola,Bola,2
Ibrahimovic Tantang Ronaldo Cetak Gol Salto dari 40 Meter,Bola,2
5 Fakta Menarik Striker Anyar Chelsea yang Jarang Diketahui Publik,Bola,2
5 Pesepak Bola Ini Berstatus Prajurit TNI,Bola,2
Fans Chelsea Komentari Kemiripan Nadeo Argawinata dan Kepa Arrizabalaga,Bola,2
10 WAGs Berpenghasilan Tinggi di Media Sosial Istri Bek Barcelona Teratas,Bola,2
Marc Marquez Ungkap Siapa Musuh Terberatnya di MotoGP 2020,Bola,2
7 Rempah-Rempah yang Berguna Menjaga Kesehatan Jantung,Bola,2
4 Bacaan Zikir yang Disukai Allah SWT usai Menjalankan Sholat,Bola,2
Pelatih Leicester Kagum Lihat Efek Berpuasa Bagi Penampilan Pemain Muslim,Bola,2
Sedang Berlangsung Live Streaming Final Badminton Olimpiade Tokyo 2020 Greysia / Apriyani di Vidio,Bola,2
Siap-Siap Klub BRI Liga 1 Segera Muncul di Game eFootball / PES,Bola,2
5 Negara Afrika yang Lolos ke Piala Dunia 2022,Bola,2
Jeka Saragih Menang di Road to UFC Pecahkan Rekor,Bola,2
Jadi Official Broadcaster Liga Inggris Vidio Bangun Euforia Sepak Bola Tanah Air dengan Datangkan Michael Owen,Bola,2
Daftar Calon Lawan MU di Play-Off Knock-Out Liga Europa Ngeri-Ngeri,Bola,2
Ungkap Borok Alejandro Garnacho di Tur Pramusim MU Bruno Fernandes Justru Menuai Kecaman,Bola,2
Hasil Liga Inggris: 10 Orang Manchester City Menang Dramatis Atas Fulham,Bola,2
Timnas Togo Tolak Main di Libya,Bola,2
7 Simbol Illuminati dan Maknanya,Citizen6,2
12 Alasan Cewek Suka Cowok Berjenggot,Citizen6,2
7 Bahasa Tubuh Cowok Beserta Maknanya Ada di Sini,Citizen6,2
7 Bahasa Tubuh Cowok Beserta Maknanya Ada di Sini,Citizen6,2
5 Film Dokumenter tentang Prostitusi yang Paling Populer,Citizen6,2
Rekam Diam-diam Percakapan Pacar Kamu dengan Aplikasi Ini,Citizen6,2
7 Macam Kepribadian dari Bentuk Kaki Kamu yang Mana?,Citizen6,2
6 Selebgram Pria Ini Lebih Cantik Dibanding Wanita,Citizen6,2
Heboh Festival Pegang Payudara di Singapura,Citizen6,2
Paul Kern Manusia yang Tak Pernah Tidur Selama 40 Tahun,Citizen6,2
Ini Alasan Mengapa Telur Sebaiknya Dikukus Ketimbang Direbus,Citizen6,2
Malapraktik Vagina Gadis Cantik Ini Berubah Fungsi,Citizen6,2
Kata-Kata Bijak Fidel Castro yang Dapat Mengubah Hidupmu,Citizen6,1
Begini Cara Mengatasi Bintik Merah di Kulit Pertanda Tumor Jinak,Citizen6,1
Terungkap Mengapa Botol Bir Selalu Berwarna Hijau dan Cokelat,Citizen6,1
Tak Perlu Service 8 Trik Ini Atasi Tombol Home iPhone yang Rusak,Citizen6,1
12 Macam Kepribadian dari Bentuk Payudara Kamu yang Mana?,Citizen6,1
Begini Cara Mengetahui Kecocokan Pernikahan Menurut Weton,Citizen6,1
Pijat Bagian Ini Selama 60 Detik Rasakan Manfaatnya Luar Biasa,Citizen6,1
Kepribadian Seseorang Bisa Terungkap dari Tatapannya,Citizen6,1
Masih Misteri 6 Penemuan Ini Membuat Peneliti Kebingungan,Citizen6,1
7 Alasan Pria Beristri Jatuh Cinta dengan Wanita Lain,Citizen6,1
Cantiknya Vanina Amalia Hidayat Istri Dean Fujioka Asal Indonesia,Citizen6,1
Ungkap Kekuatan dari Jenis Batu Sesuai Kelahiran Kamu yang Mana?,Citizen6,1
8 Makna Posisi Tahi Lalat di Hidung Lambangkan Kekayaan,Citizen6,1
Mengenal Kota Tanpa Siang di Alaska Tertarik Tinggal di Sini?,Citizen6,1
Ini Lo Alasan Kenapa Wanita Mudah Nangis Saat Punya Masalah,Citizen6,1
Terinspirasi Film Forrest Gump Pria Ini Melintasi Amerika dengan Berlari,Citizen6,1
Bercinta dengan Anjing Peliharaannya Pasutri Ditahan Polisi,Citizen6,1
4 Suara Hewan yang Dipercaya Pertanda Datangnya Makhluk Halus,Citizen6,1
Kamu Gampang Menangis? Ini 4 Maknanya dari Sisi Psikologis,Citizen6,1
Patut Dicoba Ibu Muda Tidurkan Bayinya dengan 3 Langkah Mudah,Citizen6,1
Jangan Anggap Sepele 5 Warna Kuku Bisa Ungkap Masalah Kesehatanmu,Citizen6,1
Receh Banget Tebak-tebakan Ini Dijamin Bikin Kesal Sekaligus Ngakak,Citizen6,1
30 Kata-kata Cinta Lucu Buat Pacar Kocak dan Bikin Senyum-senyum Sendiri,Citizen6,1
Tanda-tanda Kematian Menurut Islam Haruskah Percaya?,Citizen6,1
Jarang Disadari Ini 5 Alasan Wanita Tinggalkan Pria yang Dicintainya,Citizen6,1
7 Tebak-tebakan Galau Ala Warganet Ini Bikin Ngakak,Citizen6,1
Miliki Kondisi Langka 3 Orang Ini Mampu Hidup Tanpa Jantung,Citizen6,1
7 Kelakuan Cewek Labil Ini Bikin Pacarnya Gemes Sendiri,Citizen6,1
Kata-Kata Anak Racing Buat Pacar atau Gebetan tentang Motivasi dan Cinta,Citizen6,1
Kerajinan Tangan dari Botol Aqua Bekas dan Cara Pembuatannya,Citizen6,1
Hanya Lewat Foto Cara Pria Tebak Tinggi Badan Warganet Ini Jadi Viral,Citizen6,1
12 Arti Tahi Lalat di Anggota Tubuhmu Yuk Dicek,Citizen6,1
Kelewat Rapi Tulisan Tangan di Surat Lamaran Kerja Ini Viral,Citizen6,1
Jangan Minder Orang dengan Tulisan Tangan Jelek Miliki 3 Kelebihan Ini,Citizen6,1
10 Chat Gombal Plesetan Nama Orang versi Netizen Bikin Senyum-Senyum,Citizen6,1
Kocaknya 5 Momen Orang Gagal Bikin Video Tik-Tok Bikin Ketawa Geli,Citizen6,1
6 Cara Alami Menurunkan Tekanan Darah Tinggi dalam Waktu 10 Menit,Citizen6,1
4 Keuntungan yang Dimiliki Orang Berlesung Pipi Bikin Iri,Citizen6,1
Coba Perhatikan 6 Posisi Tidur yang Ungkap Suasana Hati Kucing,Citizen6,1
Ini 6 Alasan Pria Tergila-gila pada Wanita Bertubuh Curvy,Citizen6,1
Takut Membuka Hati Coba 5 Tips Menghilangkan Trauma dalam Percintaan Ini,Citizen6,1
Lakukan 5 Hal Ini Saat Merasa Bosan dengan Hubungan Anda,Citizen6,1
Cari Jajanan Pasar dan Kue Lezat lagi Murah Yuk ke Pasar Kue Subuh Senen,Citizen6,1
Ternyata Ini Penyebab Telinga Berdengung Secara Tiba-tiba,Citizen6,1
4 Alasan Mengapa Orang yang Sarkastik Lebih Cerdas Menurut Penelitian,Citizen6,1
Jangan Pernah Nikahi 9 Tipe Pria Seperti Ini,Citizen6,1
8 Tips Menghadapi Orang yang Menghina Anda Tanpa Menimbulkan Konflik,Citizen6,1
Studi: Semakin Besar Tubuh Bagian Ini Semakin Besar Alat Vitalnya,Citizen6,1
Tata Cara Salat Gerhana Bulan Lengkap dengan Bacaan Doa,Citizen6,1
Panduan Sholat Hajat dan Keutamaannya Lengkap Disertai Doa yang Mustajab,Citizen6,1
Tata Cara Sholat Istikharah Disertai Doa Hapus Keraguan Saat Hadapi Pilihan Berat,Citizen6,1
Tata Cara Sholat Dhuha Dilengkapi Bacaan Niat dan Doa serta Manfaat Menakjubkannya,Citizen6,1
Takut Muntah hingga Suara 5 Jenis Fobia Aneh yang Jarang Terjadi,Citizen6,1
4 Makna Mimpi Berhubungan Seks dengan Mantan Cek di Sini,Citizen6,1
12 Tafsir Mimpi Bertemu Ular Menurut Islam Pertanda Baik hingga Buruk,Citizen6,1
12 Tafsir Mimpi Bertemu Ular Menurut Islam Pertanda Baik hingga Buruk,Citizen6,1
12 Tafsir Mimpi Bertemu Ular Menurut Islam Pertanda Baik hingga Buruk,Citizen6,1
7 Keutamaan Membaca Surat Yasin Lancarkan Rezeki hingga Hindarkan Malapetaka,Citizen6,1
7 Tanda Ini Menunjukkan Mantan Akan Kembali Kepadamu,Citizen6,1
7 Meme Super Kocak Ibu vs Anak Anda Pernah Mengalami?,Citizen6,1
Sering Melihat Angka Kembar Berulang Kali Ini Maknya di Baliknya,Citizen6,1
8 Cara Mengatasi Sikap Posesif Pada Pasangan,Citizen6,1
5 Alasan Pasangan yang Sering Bertengkar Hubungannya Lebih Kuat,Citizen6,1
Ketahui 4 Tanda Pasangan Benar-Benar Tulus Menyayangi Anda,Citizen6,1
Cara Alami Menebalkan Alis dengan Bawang Merah Mudah Dicoba,Citizen6,1
6 Tanda Pria Benar-Benar Cinta atau Hanya Memanfaatkan Anda,Citizen6,1
Hati Menjadi Tenang 5 Keutamaan Sholat Tepat Waktu,Citizen6,1
Jenis Sholat Malam Tanpa Tidur Beserta Keistimewaannya,Citizen6,1
7 Kepribadian Seseorang di Balik Bentuk Bibirnya,Citizen6,1
7 Kepribadian Seseorang di Balik Bentuk Bibirnya,Citizen6,1
5 Tanda Anda Benar-Benar Mencintai Seseorang,Citizen6,1
8 Alasan Suami Tukang Selingkuh Tak Mau Berpisah dengan Istrinya,Citizen6,1
Ketentuan Sholat Jamak Takhir Lengkap dengan Tata Cara dan Niatnya,Citizen6,1
Top 3: Potret Farhan Ramananda Seleb TikTok yang Suka Bikin Konten Lucu,Citizen6,1
Drama Terbaru Han So Hee dan Park Hyung Sik Resmi Tayang Bulan Depan,Citizen6,1
7 Tips Agar Pria Lebih Tahan Lama di Ranjang,Citizen6,1
4 Teori Drama Twenty Five Twenty One yang Bikin Overthinking Penonton,Citizen6,1
Ladies Lakukan 4 Cara Ini untuk Memikat Hati Pria Libra,Citizen6,1
6 Zodiak Ini Jago Berciuman Sanggup Bikin Kamu Kelepek-Kelepek,Citizen6,1
99 Asmaul Husna dan Artinya Lengkap dengan Manfaat Mengamalkannya,Citizen6,1
4 Tanda Anda Masih Punya Trauma dari Hubungan Cinta Sebelumnya,Citizen6,1
6 Tips Alami Meniruskan Pipi Chubby yang Wajib Kamu Ketahui,Citizen6,1
Aturan Baru KTP Nama Minimal Dua Kata hingga Boleh Cantumkan Gelar Pendidikan,Citizen6,1
4 Amalan Sebelum Tidur yang Diajarkan Rasulullah kepada Fatimah Azzahra,Citizen6,1
4 Amalan Sebelum Tidur yang Diajarkan Rasulullah kepada Fatimah Azzahra,Citizen6,1
Menurut Astrologi Ini Dia Karier Terbaik untuk Zodiak Pisces,Citizen6,1
Penuh Drama 3 Zodiak Ini Suka Minta Putus,Citizen6,1
Mengenal Apa Itu Natto Makanan Unik Khas Jepang yang Tengah Viral,Citizen6,1
6 Contoh Kesan dan Pesan MPLS Cocok Diberikan untuk Kakak Osis,Citizen6,1
Mengenal Apa Itu Girlfriend Day yang Diperingati Setiap Tanggal 1 Agustus,Citizen6,1
5 Dampak Buruk Keseringan Onani,Citizen6,1
Ini Sosok Dilan Cepmek Viral di TikTok hingga Twitter,Citizen6,1
Viral Kebaya Merah 4 Alasan Wanita yang Pakai Baju Warna Ini Bakal Terlihat Seksi,Citizen6,1
Viral Kebaya Merah 4 Alasan Wanita yang Pakai Baju Warna Ini Bakal Terlihat Seksi,Citizen6,1
Rekam Jejak Fallincy Mbak Topi Subak Musuh Bersama Fans NCT 127 dan Kpopers,Citizen6,1
Rekam Jejak Fallincy Mbak Topi Subak Musuh Bersama Fans NCT 127 dan Kpopers,Citizen6,1
Ternyata Begini Cara Menghitung Keuntungan Crypto,Crypto,1
Mengenal Reef Coin Token Kripto Milik Platform Reef Finance,Crypto,1
Kripto GXC Coin Catatkan Kinerja Apik Menguat 20 Persen Hari Ini 18 Agustus 2022,Crypto,1
Pakaian Tepat untuk Tubuh Berbentuk Segitiga Terbalik,Fashion,1
Makna Tersembunyi di Balik 10 Tato Keren,Fashion,1
11 Trik Baru Buat Vagina Tidak Berbau,Fashion,1
5 Macam Masker Buah Bit yang Harus Anda Coba Di Rumah,Fashion,1
Wanita Setop Lakukan 5 Kebiasaan yang Bikin Pria Kabur,Fashion,1
Jangan Terlalu Sering Menggunakan Minyak Kelapa untuk Kulit Mengapa?,Fashion,1
Kisah Nenek-nenek Korea Selatan Menjadi PSK Saat Masa Tua,Global,1
Ditemukan Dinosaurus Aneh 'Setengah Bebek Setengah Buaya',Global,1
11-2-2012: Kematian Tragis Diva Pop Whitney Houston,Global,1
Ilmuwan Temukan Fosil 'Manusia Pertama di Dunia',Global,1
Saat Bomber Bom Bali Ali Imron Bertemu Keluarga Korban,Global,1
19-8-1895: 'Pria Haus Darah' Legendaris Era Koboi Tamat,Global,1
Ini 10 Tanda Anak yang Memiliki IQ Tinggi,Global,1
Bahaya Jangan Campurkan Obat dengan 6 Makanan Ini,Global,1
Kisah Petualangan Seks Angelina Jolie yang 'Aneh',Global,1
Istana Terbang' Mewah Intip Bagian Dalam Pesawat Para Miliarder,Global,1
Seperti Ini Bentuk dan Fungsi Sex Toys pada Masa Lalu,Global,1
14 Negara Bisa 'Musnah' Jika Perang Dunia III Pecah Indonesia?,Global,1
25 Artis Hollywood Ini Jaga Keperawanan hingga Menikah,Global,1
Misteri Harta Karun 'Flor de la Mar' Rp 346 T di Laut Indonesia,Global,1
9 Fakta Tragis Laika Anjing Pertama yang Mengelilingi Orbit Bumi,Global,1
Dubai Buka Lowongan Kerja Bergaji Rp 36 Miliar/Bulan,Global,1
10 Kegagalan Paling Memalukan Komando Pasukan Elite Dunia,Global,1
Simpanse Hingga Gurita 5 Hewan Cerdas yang Ada di Muka Bumi,Global,1
Jurus Jitu Hilangkan Jerawat dengan Sedotan Lintah Berani Coba?,Global,1
6 Kata dalam Bahasa Indonesia Ini Dianggap Aneh oleh Orang Rusia,Global,1
15-5-1536: Permaisuri Inggris Dihukum Mati Agar Raja Bisa Kawin Lagi?,Global,1
Meski Menyebalkan Jangan Bunuh 4 Hewan Ini Saat Bertemu,Global,1
Bukan PSK Ini 5 Fakta Geisha Jepang yang Tak Banyak Diketahui Orang,Global,1
CCTV Rekam Wanita BAB di Lorong Supermarket Lalu Ini yang Terjadi...,Global,1
10 Negara di Dunia yang Melegalkan Aktivitas Prostitusi,Global,1
5 Kisah Tsunami Paling Merusak Sepanjang Sejarah Mulai dari Jepang hingga Indonesia,Global,1
Studi: Menjadi Tampan dan Cantik Itu Tidak Sesulit yang Dibayangkan Caranya?,Global,1
Transfer Otak... Ini 5 Eksperimen Paling Menyeramkan dalam Sejarah,Global,1
5 Alasan Mengapa Orang Jenius Sulit Mendapatkan Teman,Global,1
HEADLINE: Raja Malaysia Sultan Muhammad V Turun Takhta demi Cinta?,Global,1
4 Bentuk Jabat Tangan yang Menggambarkan Maksud Seseorang,Global,1
5 Langkah Jitu Agar Pria Terpesona Melihat Kehadiran Anda,Global,1
Heboh Iluminati! Simak 9 Hal Menarik soal Organisasi Rahasia Ini,Global,1
"Tayang Kembali 28 Juni 2019 Ini Alasan ""Avengers: Endgame"" Dirilis Ulang",Global,1
8 Negara dengan Angka Perokok Paling Banyak di Dunia,Global,1
Makna di Balik 6 Simbol Jari di Sejumlah Negara,Global,1
Mudah Begini 4 Teknik Pijat Pengurang Nyeri Leher yang Bisa Dilakukan Sendiri,Global,1
5 Alasan Orang Cerdas Sulit Jatuh Cinta Anda Termasuk di Dalamnya?,Global,1
5 Nama Aneh dari Warna yang Jarang Terekspos Publik Pernah Dengar?,Global,1
HEADLINE: Donald Trump Siap Damai dengan Iran Perang Terbuka Masih Mengancam?,Global,1
Bawang Putih 11 Ramuan Alami yang Diklaim Ampuh Obati Jamur Pada Tubuh,Global,1
7 Tanda Ketika Hubungan dengan Pasangan Tak Lagi Pantas Dipertahankan,Global,1
Datang ke Pesta dengan 6 Ibu Hamil Pria Nigeria Tuai Kritik dan Kontroversi,Global,1
Punya Banyak Bintik-Bintik Putih di Bawah Mata? Begini Cara Mengatasinya,Global,1
6 Kemungkinan Asal Suara Bising Saat Malam Hari,Global,1
23 Mei 1960: Adolf Eichman Anggota Nazi Pelaksana Utama Holocaust Ditangkap Israel,Global,1
Ada yang Makan Kaki Sendiri Ini 5 Kanibal Paling Menyeramkan di Dunia,Global,1
3 Fakta Alcatraz Pulau Bekas Penjara Paling Ketat di Amerika Serikat,Global,1
Direbus hingga Dikuliti 5 Hukuman Mati Paling Mengerikan pada Zaman Kuno,Global,1
5 Skandal Kanye West: Mulai dari Taylor Swift Kim Kardashian hingga Billie Eilish,Global,1
5 Alasan Mengapa Bulu Halus di Wajah Anda Cepat Tumbuh,Global,1
4 Juli 1774: Ada Alquran di Balik Kisah Kemerdekaan Amerika Serikat?,Global,1
8 Fakta Pulau Socotra Flora dan Fauna Unik hingga Tempat Paling Asing di Bumi,Global,1
PM Denmark Mette Frederiksen Mundur dari Jabatannya Sehari Setelah Menang Pemilu Ada Apa?,Global,1
Paus Fransiskus Mengaku Pernah Jadi `Tukang Pukul` Klub Malam,Global,1
Health Info,Kabar,1
Waspadai Kontraksi Palsu Saat Usia Kandungan ke-8,Health,1
Ini Beda Pria yang Disunat dan Tidak,Health,1
5 Cara Jadikan Doggy Style Makin Dahsyat,Health,1
