Judul,Jenis,User Aktif
Reuni Tokoh-tokoh Harry Potter Lihat Wajah Asli Mereka Sekarang,ShowBiz,1
Foto Bugil 10 Artis Indonesia yang Beredar di Internet,ShowBiz,1
Foto Bugil 10 Artis Indonesia yang Beredar di Internet,ShowBiz,1
10 Artis Indonesia yang Dinikahi Pria Bule,ShowBiz,1
Tak Sengaja 10 Celana Dalam Artis Ini Kelihatan,ShowBiz,1
3 Film The Hobbit Habiskan Rp 96 Triliun Baik atau Buruk?,ShowBiz,1
Beyonce Goyang Bokong Bergetar,ShowBiz,1
Eminem Menyesal Ancam Perkosa Iggy Azalea,ShowBiz,1
Foto-foto Memalukan Seleb Hollywood Tessa Ogah Kasih Selamat,ShowBiz,1
"""Club Eighties"" Tampil Tak Senonoh",ShowBiz,1
Selalu Ditutup Wig Sia Akhirnya Tunjukkan Wajah Asli,ShowBiz,1
Kanye West Bocorkan Rahasia Kim Kardashian Tentang Hal Ini,ShowBiz,1
Demi Dini Indra Brugman Keluar dari Contoh,ShowBiz,1
Rika Ikut Senam Kateda,ShowBiz,1
Femmy Permatasari Mengurung Diri,ShowBiz,1
4 Lagu K-Pop dengan Lirik Berbau Seks,ShowBiz,1
6 Anime Mecha Paling Populer di Dunia,ShowBiz,1
Kisah 10 Artis Panas Bintang Film Lawas,ShowBiz,1
Kisah 10 Artis Panas Bintang Film Lawas,ShowBiz,1
Shah Rukh Khan Blak-blakan Soal Perasaannya terhadap Kajol,ShowBiz,1
Selim dan Zaenab Tebar Pesona Isyarat Elif Season 2 Masih Lanjut,ShowBiz,1
10 Artis Dunia yang Pernah Jadi Bintang Porno,ShowBiz,1
Benarkah Batman Sempat Bercinta dengan Ibu Superman?,ShowBiz,1
Naruto Luncurkan Kisah di Pemandian Air Panas,ShowBiz,1
6 Artis Hollywood yang Tampan tapi Bau Badan,ShowBiz,1
Bom Turki Raline Shah Sedih karena Ayah,ShowBiz,1
Lama di Inggris Maudy Ayunda Penasaran Tempat Indah di Indonesia,ShowBiz,1
Skandal Seks Terbongkar 6 Artis Hollywood ini Harus Bayar Mahal,ShowBiz,1
Mengenang Para Pemain Film Harry Potter yang Meninggal Dunia,ShowBiz,1
Cerita Janda Elvis Presley yang Cinta Mati pada Sang Raja,ShowBiz,1
Cerita Sedih di Balik Lagu Nge-hits Big Bang Rilis 2016,ShowBiz,1
Uus Bongkar Kehidupan Istrinya Sebelum Menikah,ShowBiz,1
10 Artis Cantik dan Seksi Bollywood dengan Pendapatan Selangit,ShowBiz,1
Cerita Tak Terlupakan Adegan Ciuman 10 Aktor Tampan Korea,ShowBiz,1
6 Sekuel Film Horor dengan Adegan Seks dan Sadis Lebih Tegang,ShowBiz,1
Kim Jaejoong JYJ Disebut Artis K-Pop Berbahaya,ShowBiz,1
6 Fakta Miris di Balik Pemakaman Yana Zein,ShowBiz,1
Demi Suspicious Partner Nam Ji Hyun Rela Tubuhnya Dibanting,ShowBiz,1
Usia Muda 4 Artis Korea Ini Rela Pamer Payudara Saat Akting,ShowBiz,1
Divonis Kanker Paru Gitaris Rolling Stones Siap-Siap Meninggal,ShowBiz,1
Bertabur Cinta Drama Baru Lee Jong Suk dan Suzy Laris Manis,ShowBiz,1
Ini 10 Artis K-Pop Tercantik yang Diakui Dunia,ShowBiz,1
10 Artis Cantik Korea dengan Bayaran Tertinggi Saat Ini,ShowBiz,1
Tak Pernah Tersorot Media Wajah Ayah Chicco Jerikho Bikin Gagal Fokus,ShowBiz,1
Simpan Cerita Cintanya Sung Hoon dan Song Ji Eun Telah Pacaran 1 Tahun?,ShowBiz,1
Soal Teori Konspirasi di Film Home Alone Ini Kata Macaulay Culkin,ShowBiz,1
Dragon Ball Super 131 Akhir Cerita yang Sesuai Harapan,ShowBiz,1
Wika Salim Beberkan Alasan Menikah dan Bercerai Diam-Diam,ShowBiz,1
Benci Tapi Rindu Uniknya Kisah Cinta Chikita Meidy dan Calon Suami,ShowBiz,1
Pertama Kali Konser di Indonesia TWICE Jadikan Momen Spesial,ShowBiz,1
Mantan Istri Habib Usman Bin Yahya Tak Kalah Cantik dari Kartika Putri,ShowBiz,1
Deretan Mantan Suami Nikita Mirzani Berseteru hingga Rebutan Hak Asuh Anak,ShowBiz,1
Saling Buka Aib Simak 6 Pengakuan Goo Hye Sun Vs Ahn Jae Hyun,ShowBiz,1
5 Fakta Hidup Freddie Mercury yang Bikin Geleng-Geleng Kepala,ShowBiz,1
Cassandra Lee dan 5 Aktris Berwajah Bule Keturunan Jawa Ini Aktingnya Kece,ShowBiz,1
Arie Kriting Cuma Bisa Melihat Adiknya Menikah Secara Online,ShowBiz,1
Anya Geraldine Pertama Kali Jadi Host Talkshow Jadi Sering Bercanda,ShowBiz,1
RM BTS Tembus Skor TOEIC 915 Kok Masih Merasa Dirinya Payah?,ShowBiz,1
Andre Taulany Beli Saham Muse Media Siap Terjun ke Bisnis Media Digital,ShowBiz,1
Luna Maya dan 6 Artis Ini Keranjingan Main Golf Nomor 3 Level Cantiknya Enggak Bisa Didebat,ShowBiz,1
Alasan yang Sebenarnya Ari Lasso Keluar dari Dewa 19,ShowBiz,1
7 Potret Terkini Mira Asmara Kakak Sahrul Gunawan di Sinetron Jin dan Jun,ShowBiz,1
Klinik Kecantikan Beningâ€™s Clinic Milik Oky Pratama Dilirik Artis Ibu Kota Berkat Kecanggihannya,ShowBiz,1
Desiree Tarigan Tak Mau Rujuk dengan Hotma Sitompul Minta Tanah Ibunya Dikembalikan,ShowBiz,1
Cerita Tarra Budiman Dekati Gya Sadiqah yang Hampir Menikah,ShowBiz,1
Pengakuan Mantan Bintang Panas Windy Chindyana: Diajari Akting Sally Marcellina Klik dengan Ibra Azhari,ShowBiz,1
Profil 5 Bintang TVM Bidadari Malam SCTV Ada Anggika Bolsterli dan Rionaldo Stokhorst,ShowBiz,1
Nia Ramadhani dan Ardi Bakrie Divonis 1 Tahun Penjara Terkait Kasus Narkoba,ShowBiz,1
Seo Ye Ji Akhirnya Minta Maaf soal Skandalnya dengan Kim Jung Hyun Hampir Setahun Membisu,ShowBiz,1
Cerita Kim Sejeong Bertemu dengan Ayahnya yang Tinggal di Indonesia Setelah Berpisah Bertahun-tahun,ShowBiz,1
Alasan Ayah Mertua Ustaz Solmed Bersih-bersih Sebelum Meninggal: Ada Tamu Sudah Menunggu di Depan,ShowBiz,1
15 Rekomendasi Film China Mulai dari Aksi hingga Komedi Nonton Semuanya di Vidio,ShowBiz,1
Sinopsis 365 Days 2 Kemunculan Pria Ketiga di Hubungan Panas Laura - Massimo,ShowBiz,1
4 Potret Pertunangan Farhan Mantan Artis Cilik Pemeran Tuyul di FTV Gentabuana Era 2000-an,ShowBiz,1
5 Potret Sean Mikael Alexander Rayakan Ultah ke-17 Olla Ramlan dan Mantan Suami Kompak di Pesta Sang Anak,ShowBiz,1
Sudah Cerai Olla Ramlan dan Aufar Hutapea Kompak Pamer Foto Bareng Rayakan Idul Adha 2022,ShowBiz,1
Profil Go Yoon Jung yang Isunya Bakal Gantikan Jung So Min Jadi Aktris Utama Alchemy Of Souls,ShowBiz,1
Putra Siregar Dituntut 10 Bulan Penjara Atas Kasus Dugaan Pengeroyokan,ShowBiz,1
Vidhia R Rambah Dunia Tarik Suara Usai Viral di TikTok,ShowBiz,1
Sinopsis Bad Romeo Episode Terakhir Terungkap Sosok Ibu Kandung Kaokla dan Nasib Cintanya dengan Saikhim,ShowBiz,1
Saksikan Lokadrama Lara Ati Disutradarai Bayu Skak Tayang Senin 19 September 2022 Pukul 14.00 WIB Via Live Streaming SCTV di Sini,ShowBiz,1
Dewi Perssik Terang-terangan Bilang ke Rian Ibram Ingin Melahirkan Anak Mengaku Tak Butuh Harta Suami Barunya Kelak,ShowBiz,1
Lirik Lagu Gang Dolly dari Pak No dan Pak Ndut Plus Terjemahan Trending Nomor 1 Bekas Pacar di Lokalisasi,ShowBiz,1
Luna Maya Setuju Ariel NOAH Pacari Bunga Citra Lestari,ShowBiz,1
6 Fakta Nikita Mirzani Dijebloskan ke Penjara Atas Laporan Dito Mahendra Dibidik Pasal Berlapis,ShowBiz,1
Raffi Ahmad Minta Nagita Slavina Jangan Pernah Selingkuh Bilang: Sebandel-bandelnya Aku Cuma Mencuci Mata,ShowBiz,1
Sinopsis Rab Ne Bana Di Jodi Tayang Sabtu Pagi Ini Pria Lugu Makeover Jadi Keren Demi Rebut Hati Istrinya yang Dilanda Trauma,ShowBiz,1
Keanu Massaid Masukkan Alat Golf dan Topi ke Peti Jenazah Lucky Sondakh Tak Kuat Berada di Rumah Duka,ShowBiz,1
Keanu Massaid Masukkan Alat Golf dan Topi ke Peti Jenazah Lucky Sondakh Tak Kuat Berada di Rumah Duka,ShowBiz,1
Anime Kage no Jitsuryokusha ni Naritakute Episode 5 Jadi Tontonan Paling Dicari Begini Kisahnya,ShowBiz,1
Banyak Konser Musik dan Festival Terancam Batal Asosiasi Promotor Musik Indonesia Gercep Ambil Sikap,ShowBiz,1
Dewi Perssik Diminta Silaturahmi ke Lesti Kejora Sebagai Senior Usai Sayembara Rp 100 Juta dan Polisikan Emak-emak,ShowBiz,1
Hati Selena Gomez Remuk Obat Gangguan Bipolar yang Ia Minum Membuatnya Terancam Tak Dapat Hamil,ShowBiz,1
5 Momen Kebersamaan Nathalie Holscher dan Mantan Kekasih Sudah Dekat dengan Adzam,ShowBiz,1
11 Aktor Ini Perankan Presiden AS,ShowBiz,1
Nikita Mirzani Dikenal karena Take Me Out dan Siraman Air Panas,ShowBiz,1
Apa Iya Nikita Mirzani Meninggal Dunia?,ShowBiz,1
10 Tujuan Wisata yang Ada di Kenjeran Surabaya,Surabaya,1
6 Potret Pedangdut Intan Chacha Asal Blitar yang Cantik dan Memesona,Surabaya,1
Mau ke Lombok dari Banyuwangi? Cek Tarif Tiket Kapalnya di Sini,Surabaya,1
Kode Sejumlah Plat Nomor di Jatim Berubah Jombang Kini Jadi W,Surabaya,1
35 Tahun Tragedi Wirjo Pelaku Pembantaian Puluhan Warga Banyuwangi Dalam Sehari,Surabaya,1
Berita Angka Sial Hari Ini,Kabar,1
Berita Anthony Ginting Kalah Hari Ini,Kabar,1
Berita Aplikasi Shopee Error Hari Ini,Kabar,1
Berita Ayu Ting Ting Hari Ini,Kabar,1
Berita Brigadir J Hari Ini,Kabar,1
Berita Cara Delevingne Hari Ini,Kabar,1
Berita Cekbansos.kemensos.go.id Hari Ini,Kabar,1
Berita Confidential Assignment 2: International Hari Ini,Kabar,1
Berita Corona Hari Ini,Kabar,1
Berita Denny Caknan Hari Ini,Kabar,1
Berita Dimas Kanjeng Hari Ini,Kabar,1
Berita Ferdy Sambo Hari Ini,Kabar,1
Berita Ferdy Sambo Hari Ini,Kabar,1
Berita Gerard Pique Hari Ini,Kabar,1
Berita Harga Emas Hari Ini,Kabar,1
Berita harga minyak mentah Hari Ini,Kabar,1
Berita Hong Kong Hari Ini,Kabar,1
Berita Indonesia vs Australia Hari Ini,Kabar,1
Berita Indosat gangguan Hari Ini,Kabar,1
Berita Instagram Eror Hari Ini,Kabar,1
Berita Jadwal Liga Italia Hari Ini,Kabar,1
Berita Jeje Slebew Hari Ini,Kabar,1
Berita Kanye West Hari Ini,Kabar,1
Berita Kasper Schmeichel Hari Ini,Kabar,1
Berita kebakaran depok Hari Ini,Kabar,1
Berita kebakaran jakarta Hari Ini,Kabar,1
Berita kebakaran Jakarta Selatan Hari Ini,Kabar,1
Berita kebakaran solo Hari Ini,Kabar,1
Berita kecelakaan surabaya Hari Ini,Kabar,1
Berita Kecelakaan Tol Pekanbaru-Dumai Hari Ini,Kabar,1
Berita Kuljeet Randhawa Hari Ini,Kabar,1
Berita Manchester City Hari Ini,Kabar,1
Berita Manchester United vs Aston Villa Hari Ini,Kabar,1
Berita Manchester United Hari Ini,Kabar,1
Berita Manchester United Hari Ini,Kabar,1
Berita membuka acara SCTV Goes To Campus yang digelar di Kampus Universitas Airlangga Hari Ini,Kabar,1
Berita Michael Coste Hari Ini,Kabar,1
Berita MU Hari Ini,Kabar,1
Berita Natalie Foxee Hari Ini,Kabar,1
Berita Nikita Mirzani Hari Ini,Kabar,1
Berita Nikita Mirzani Hari Ini,Kabar,1
Berita Nunung Hari Ini,Kabar,1
Berita Pelabuhan Merak Hari Ini,Kabar,1
Berita Piala AFF U-19 2022 Hari Ini,Kabar,1
Berita Polres Trenggalek Hari Ini,Kabar,1
Berita Puncak Bogor Hari Ini,Kabar,1
Berita resesi adalah Hari Ini,Kabar,1
Berita Saham Bukalapak Hari Ini,Kabar,1
Berita Sandy Harun Hari Ini,Kabar,1
Berita Selena Gomez Hari Ini,Kabar,1
Berita sholawat Hari Ini,Kabar,1
Berita Soraya Larasati Hari Ini,Kabar,1
Berita Steven Seagal Hari Ini,Kabar,1
Berita susu formula Hari Ini,Kabar,1
Berita Timnas Indonesia Hari Ini,Kabar,1
Berita TKI Tewas di Turki Hari Ini,Kabar,1
Berita Tri Suaka Hari Ini,Kabar,1
Berita Video Kebaya Merah Hari Ini,Kabar,1
Begini Cara Melacak Alamat Email Seseorang,Tekno,1
Video Nakal YouTube Bersembunyi di Balik 'Irlandia',Tekno,1
Inilah Alat Penyadap Ponsel yang Sering Digunakan Intelijen,Tekno,1
9 Fakta Ilmiah di Film The Martian,Tekno,1
Cara Menggunakan Google Translate di WhatsApp versi Android,Tekno,1
Jangan Panik Ini yang Harus Dilakukan Jika Ponsel Jatuh,Tekno,1
Ketahui 5 Hal Penting Ini sebelum Menggunakan WiFi Publik,Tekno,1
Memori iPhone Penuh Begini Cara Mudah Membersihkannya,Tekno,1
Tanya Tekno: Cara Mematikan Getar dan Suara di Keyboard Android,Tekno,1
Cara Gampang Mengecek Ejaan Tulisan di Microsoft Word,Tekno,1
Ingin Lagu Favorit Jadi Nada Alarm di Android? Lakukan Cara Ini,Tekno,1
Begini Cara Matikan Notifikasi di iPhone yang Menganggu,Tekno,1
4 Nomor Ponsel Cantik Harga Selangit Paling Mahal Rp 281 Miliar,Tekno,1
Cara Mudah Bikin Suara Speaker iPhone Makin Jernih,Tekno,1
Luar Biasa Pesan Rahasia Ini Tersimpan di PS2 Hampir 2 Dekade,Tekno,1
5 Hal Ini Bisa Jadi Tanda Komputer Diserang Virus dan Malware,Tekno,1
Kelebihan dan Kekurangan Samsung Galaxy Note 9,Tekno,1
5 Manfaat Mode Do Not Distrub di iPhone,Tekno,1
Bluetooth di iPhone Kamu Mengalami Masalah? Tips Ini Patut Dicoba,Tekno,1
Cannibal Cafe Situs Jual Beli Daging Manusia yang Sempat Bikin Geger,Tekno,1
Kenali 5 Jenis Penipuan SMS dan Cara Mencegahnya,Tekno,1
Harga Samsung Galaxy A5 2017 dan Spesifikasi Ponsel Tahan Air dan Debu,Tekno,1
4 Cara Menambah Memori Internal iPhone Bikin Penyimpananmu Makin Luas,Tekno,1
Cara Membuat Aplikasi Android Sederhana dan Bisa Dibuat Sendiri,Tekno,1
5 Fitur Tersembunyi di Line Ini Jarang Diketahui Perlu Kamu Coba Trik Rahasianya,Tekno,1
"Tanya Tekno: Apa Solusi untuk ""Tegangan Daya terlalu Tinggi""?",Tekno,1
Pengguna Instagram Kini Kamu Bisa Setop Akses Data Pribadi ke Aplikasi Pihak Ketiga,Tekno,1
Ada Celah Keamanan di Android Aplikasi Kamera Bisa Diretas,Tekno,1
Beredar soal Hacker Bisa Ambil Alih Grup Chat WhatsApp Ini Faktanya,Tekno,1
Peneliti Keamanan Temukan Bug Berbahaya di Aplikasi SHAREit Versi Android,Tekno,1
Menguji Kebolehan Kamera 48MP Redmi Note 10 Seperti Apa Hasil Fotonya?,Tekno,1
Sony Batal Tutup Layanan PlayStation Store untuk PS3 dan PS Vita,Tekno,1
Cara Pakai Fitur View Once WhatsApp yang Baru Meluncur di iOS dan Android,Tekno,1
Jangan Sampai Salah Ini Tips Memilih Paket Berlangganan Netflix,Tekno,1
Cara Restart STB IndiHome untuk Dapat Kompensasi Akses Semua Channel dari Telkom,Tekno,1
Ingin Main eFootball 2022 di PC Cek Spesifikasi Minimum di Sini,Tekno,1
5 Modus Penipuan Online Ini Semakin Marak Terjadi,Tekno,1
Cara Mengetahui Password Tersimpan di Google Chrome,Tekno,1
Cara Mengetahui Password Tersimpan di Google Chrome,Tekno,1
AirPods 3 Resmi Hadir di Indonesia Berapa Harganya?,Tekno,1
Aplikasi PeduliLindungi Hilang dari App Store Tenang Kamu Bisa Instal via Link Ini,Tekno,1
Cara Cek Nomor WhatsApp Kita Diblokir Teman,Tekno,1
Kupas Kemampuan Snapdragon 680 yang Tertanam di Oppo Reno7,Tekno,1
Beli Kartu Pokemon Rp 75 Miliar YouTuber Logan Paul Diganjar Guinness World Records,Tekno,1
Deretan HP Xiaomi Ini Tak Akan Terima Pembaruan Software Apa Saja?,Tekno,1
Ramai Layanan WiFi Koin di Internet Apa Itu?,Tekno,1
Cara Pindahkan Riwayat Chat di WhatsApp Jika Ingin Ganti HP,Tekno,1
Cara Pindahkan Riwayat Chat di WhatsApp Jika Ingin Ganti HP,Tekno,1
Pengguna di Indonesia Kini Bisa Nonton Video Podcast di Spotify,Tekno,1
Waspada 8 Aplikasi Jahat Diam-Diam Kuras Duit Pengguna Android,Tekno,1
Cara dan Syarat Klaim Kode Redeem FF untuk Dapat Hadiah Gratis di Game,Tekno,1
Pengguna Bakal Bisa Pakai WhatsApp di iPad dan Tablet Android?,Tekno,1
Cara Setting STB TV Digital Gampang dan Enggak Ribet,Tekno,1
Banyak Akun Pengguna Mandadak Hilang Instagram Minta Maaf,Tekno,1
Ini Penyebab Instagram Down yang Sempat Bikin Panik Pengguna,Tekno,1
Pemerintah Buka Posko Respons Cepat Penanganan Bantuan STB Gratis di Jabodetabek Di Mana Saja?,Tekno,1
Piala Dunia 2022 Qatar dengan Siaran TV Digital Jadi Makin Bersih dan Jernih,Tekno,1
Daftar Harga Set Top Box TV Digital Tertarik Beli yang Mana?,Tekno,1
"Profil Singkat Kapolres Cianjur AKBP Doni yang Trending di Media Sosial Twitter ",Regional,46
"Profil Singkat Kapolres Cianjur AKBP Doni yang Trending di Media Sosial Twitter ",Regional,24
"Tata Cara Sholat Dhuha Dilengkapi Bacaan Niat dan Doa serta Manfaat Menakjubkannya ",Citizen6,11
"Tata Cara Sholat Dhuha Dilengkapi Bacaan Niat dan Doa serta Manfaat Menakjubkannya ",Citizen6,11
"50 Kata Kerja dalam Bahasa Inggris Lengkap dengan Contoh Kalimat ",Hot,8
"Cara Mencari Median Data Tunggal dan Kelompok Pahami Langkah-Langkahnya ",Hot,7
"Bacaan Niat dan Tata Cara Sholat Hajat Beserta Doanya Insya Allah Makbul ",Islami,6
"Keluh Kesah Muzdalifah Sebelum Dilarikan ke Rumah Sakit: Sabar Saat Dianiaya Tak Membalas Kala Difitnah ",ShowBiz,6
"Tata Cara Sholat Dhuha Dilengkapi Bacaan Niat dan Doa serta Manfaat Menakjubkannya ",Citizen6,6
"150 Contoh Kata Sifat dalam Bahasa Inggris dan Artinya dalam Bahasa Indonesia ",Hot,5
"Unsur Intrinsik Cerpen dan Ekstrinsik Lengkap Contoh dan Penjelasannya ",Hot,5
"Kembali Berlaku Cek 26 Titik Ganjil Genap Jakarta Hari Ini Senin 28 November 2022 ",News,5
"8 Teknik Dasar dalam Permainan Basket Beserta Penjelasan Lengkapnya ",Citizen6,5
"Pengertian Fungsi Serta Cara Menghitung Median ",Citizen6,4
"Pengertian Nasionalisme Menurut Para Ahli Kenali Sikap dan Bentuknya ",Hot,4
"6 Macam-Macam Tawaf yang Dilakukan Jamaah Haji Ketahui Tata Caranya ",Hot,4
"Pengertian Motivasi Menurut Para Ahli dan Jenis-jenisnya yang Perlu Dikenali ",Hot,4
"Fungsi CTRL A sampai Z pada Microsoft Word Bantu Memudahkan Pekerjaan ",Hot,4
"Pengertian Khutbah Syarat Rukun dan Tata Caranya dalam Islam ",Hot,4
"Pengertian Reformasi adalah Perubahan Drastis untuk Perbaikan Tujuan Penyebab dan Contohnya ",Hot,4
"7 Penyebab Kebangkrutan VOC Korupsi sampai Utang ",Hot,4
"16 Arti Mimpi Digigit Ular Menurut Islam dan Primbon Jawa Pertanda Harus Waspada ",Hot,4
"7 Contoh Gambar 2 Dimensi Kenali Unsur dan Contoh Seni Rupa 2 Dimensi Lainnya ",Hot,4
"60 Contoh Kalimat Simpleks Simak Pula Pengertian dan Ciri-Cirinya ",Hot,4
"Bacaan Niat dan Tata Cara Sholat Hajat Beserta Doanya Insya Allah Makbul ",Islami,4
"Tanah Timur Indonesia Darurat Kekerasan Seksual pada Anak ",News,4
"‘Nyanyian’ Sambo dan Hendra Soal Ismail Bolong Bikin Kapolri Berang hingga Turun Tangan ",News,4
"Sadar Dibohongi Hendra Kurniawan ke Agus Nurpatria: Kita Dikadalin Ferdy Sambo ",News,4
"Dilaporkan Hilang di Kapal Surabaya-Makassar Mahasiswi Unair Ditemukan Tewas di Pantai Selayar ",Regional,4
"Kiky Saputri Beri Jawaban Terkait Pengusiran Wendy Cagur oleh Anaknya: Aku Memang Dekat ",ShowBiz,4
"Berita Gempa Cianjur Hari Ini ",Kabar,4
"Berita Indosat gangguan Hari Ini ",Kabar,4
"UMP 2023 Naik 10 Persen Daftar Provinsi dengan Upah Minimum Tertinggi dan Terendah ",Bisnis,4
"Senam Lantai: Pengertian Sejarah Manfaat dan Macam-Macam Gerakan Dasar Lengkap ",Bola,4
"Tata Cara Sholat Jamak dan Qasar Beserta Niat Juga Artinya ",Citizen6,4
"12 Tafsir Mimpi Bertemu Ular Menurut Islam Pertanda Baik hingga Buruk ",Citizen6,3
"Bacaan Doa Istighosah Lengkap dengan Artinya untuk Meminta Pertolongan Allah SWT ",Citizen6,3
"4 Arti Mimpi Darah Haid Pertanda Kejadian Tak Terduga akan Datang ",Citizen6,3
"Revolusi Makanan: Daging Buatan dari Sel Punca ",Global,3
"13 Arti Mimpi yang Terkait dengan Kematian ",Health,3
"Dari Lecet Hingga Kanker Tulang yang Renggut Nyawa Lolyta ",Health,3
"40 Kata Mutiara Bahasa Arab dan Artinya Penuh Makna Mendalam ",Hot,3
"8 Cara Mencegah Korosi Ketahui Penyebabnya ",Hot,3
"100 Kata Benda dalam Bahasa Arab Lengkap dengan Cara Baca dan Artinya ",Hot,3
"Kenali 5 Bahaya Radiasi Elektromagnetik Ponsel yang Bisa Rusak Saraf Otak ",Hot,3
"150 Contoh Kata Sifat dalam Bahasa Inggris dan Artinya dalam Bahasa Indonesia ",Hot,3
"480 Kata Sifat dalam Bahasa Inggris A-Z Lengkap dengan Artinya ",Hot,3
"10 Arti Mimpi Ular Menurut Islam Dipercaya Berikan Pertanda Baik ",Hot,3
"10 Arti Mimpi Ular Menurut Islam Dipercaya Berikan Pertanda Baik ",Hot,3
"Gambar Dekoratif Adalah Bercorak Dekor Ketahui Fungsi dan Tips Membuatnya ",Hot,3
"20 Makanan Khas Suku Minangkabau Dominasi Rasa Pedas dan Kaya Rempah ",Hot,3
"8 Unsur-unsur Seni Rupa Wajib Tahu dan Jangan Sampai Tertukar ",Hot,3
"Separatisme adalah Gerakan untuk Memisahkan Diri Kenali Penyebab dan Contohnya ",Hot,3
"Unsur-Unsur Seni Rupa dan Penjelasannya Mudah Dipahami ",Hot,3
"Mengenal Macam-macam Garis dalam Seni Rupa dan Gambar Teknik ",Hot,3
"50 Kata Kerja dalam Bahasa Inggris Lengkap dengan Contoh Kalimat ",Hot,3
"Unsur Intrinsik Cerpen dan Ekstrinsik Lengkap Contoh dan Penjelasannya ",Hot,3
"Unsur Intrinsik Cerpen dan Ekstrinsik Lengkap Contoh dan Penjelasannya ",Hot,3
"24 Macam-Macam Gaya Bahasa dan Contohnya Simak Penjelasan Ahli ",Hot,3
"Hak Warga Negara adalah Mendapatkan Penghidupan yang Layak Simak UUDnya ",Hot,3
"6 Macam-Macam Tawaf yang Dilakukan Jamaah Haji Ketahui Tata Caranya ",Hot,3
"Pengertian Motivasi Menurut Para Ahli dan Jenis-jenisnya yang Perlu Dikenali ",Hot,3
"15 Arti Mimpi Melihat Ular Besar Salah Satunya Tanda Harus Introspeksi ",Hot,3
"Mengenal Grafik Fungsi Kuadrat Beserta Rumus dan Contoh Soalnya ",Hot,3
"3 Contoh Cerpen Kehidupan yang Menarik Inspiratif dan Sarat Makna ",Hot,3
"Letak Astronomis Indonesia adalah 6° LU - 11° LS 95° BT - 141° BT Pahami Pengaruhnya ",Hot,3
"5 Cara Memegang Raket Badminton yang Benar Perkuat Smash ",Hot,3
"60 Kata Bijak Motivasi Kerja yang Menginspirasi dan Bangkitkan Semangat ",Hot,3
"6 Faktor Internal Penyebab Pelanggaran HAM di Indonesia Lengkap Penjelasannya ",Hot,3
"8 Penyebab Keyboard Laptop Tidak Berfungsi yang Wajib Diketahui ",Hot,3
"Fastabiqul Khairat Artinya Berlomba dalam Kebaikan Begini Melakukannya ",Hot,3
"Contoh Mad Thabi'i dalam Alquran Pahami Pengertian dan Cara Bacanya ",Hot,3
"56 Kata Bijak Uchiha Itachi Bijaksana dan Penuh Pengorbanan ",Hot,3
"6 Potret Penampilan Abidzar Saat Umroh Jadi Sorotan Ini Nasehat Umi Pipik ",Hot,3
"Denda-Denda yang Harus Dibayarkan saat Melanggar Wajib Haji ",Islami,3
"Instagram vs Realita Bali Diungkap Turis Australia: Jangan Tertipu ",Lifestyle,3
"Pantun Kekhasan Bangka yang Nyaris Tenggelam ",News,3
"5 Maret 1960: Presiden Sukarno Bubarkan DPR Hasil Pemilu Pertama ",News,3
"Tentang Median: Pengertian Rumus hingga Cara Menghitungnya ",News,3
"Tentang Median: Pengertian Rumus hingga Cara Menghitungnya ",News,3
"Banjir Banyuwangi Kian Parah Beberapa Rumah Hanya Terlihat Atap ",Surabaya,3
"Banjir Banyuwangi Kian Parah Beberapa Rumah Hanya Terlihat Atap ",Surabaya,3
"5 Fase Kemajuan Teknologi dari Masa ke Masa ",Tekno,3
"Penyebab Biznet Down Hari Ini Selasa 29 November 2022: Akui Ada Gangguan ",Tekno,3
"Bacaan Sholawat Munjiyat Arab Latin dan Artinya: Keutamaannya Menakjubkan ",Islami,3
"10 Pantun Pembuka Ceramah Lucu dan Keren Bisa Hibur Jemaah ",Islami,3
"Biodata Ustadzah Halimah Alaydrus: Sosok Keturunan Nabi Pendakwah dan Penulis Produktif ",Islami,3
"10 Bau Ini Tanda Kedatangan Makhluk Halus? ",Citizen6,3
"8 Pertandingan Piala Dunia 2022 Tayang Eksklusif di Vidio Tidak Disiarkan di Televisi ",Bola,3
"Sadar Dibohongi Hendra Kurniawan ke Agus Nurpatria: Kita Dikadalin Ferdy Sambo ",News,2
"Syarat Lolos 16 Besar Piala Dunia 2022 dari Grup C: Argentina Belum Aman Meksiko Punya Peluang ",Bola,2
"Skandal Boneka BDSM Balenciaga Minta Maaf ",Global,2
"Dangdut Academy 5: Sridevi Lolos ke Babak Top 3 Bareng Eby dan Afan ",ShowBiz,2
"Bersinar di Piala Dunia 2022 MU Harus Tebus Gelandang Incarannya Rp 18 Triliun ",Bola,2
"Heru Budi Soal Pengelolaan Kampung Susun Bayam: Belum Ada Pengalihan ",News,2
"Cek 26 Lokasi Ganjil Genap di Jakarta Hari Ini 30 November 2022 untuk Pelat Genap ",News,2
"3 Pertanyaan Keuangan Paling Umum dan Jawabannya versi Pakar ",Bisnis,2
"Terlanjur Utang di Pinjol Ilegal? Tenang Segera Lakukan Hal Ini ",Bisnis,2
"HEADLINE: Penetapan UMP 2023 Didemo Ditolak hingga Digugat Apa Upaya Win-Win Solution? ",Bisnis,2
"Jadwal Pertandingan Piala Dunia 2018 Korsel Vs Meksiko ",Bola,2
"Senam Lantai: Pengertian Sejarah Manfaat dan Macam-Macam Gerakan Dasar Lengkap ",Bola,2
"Senam Lantai: Pengertian Sejarah Manfaat dan Macam-Macam Gerakan Dasar Lengkap ",Bola,2
"Bukan Cuma Italia 4 Raja Eropa Ini Gagal Lolos ke Piala Dunia ",Bola,2
"Mengenal Senam Artistik: Sejarah Nomor Pertandingan dan Manfaatnya ",Bola,2
"Bersinar di Piala Dunia 2022 MU Harus Tebus Gelandang Incarannya Rp 18 Triliun ",Bola,2
"Bersinar di Piala Dunia 2022 MU Harus Tebus Gelandang Incarannya Rp 18 Triliun ",Bola,2
"Daftar 7 Tim yang Lolos 16 Besar Piala Dunia 2022: Belanda dan Inggris Amankan Tiket ",Bola,2
"5 Kisah Legendaris Anak Durhaka pada Ibu ",Citizen6,2
"Tata Cara Sujud Sahwi Lengkap dengan Doa dan Waktu Melakukannya ",Citizen6,2
"Proses Komunikasi dan Pengertiannya Menurut Para Ahli ",Citizen6,2
"10 Kata Mutiara Hidup Adalah Pilihan untuk Tetap Optimis ",Citizen6,2
"4 Ciri-ciri Globalisasi yang Tanpa Disadari Mengubah Kehidupan ",Citizen6,2
"5 Fungsi Daun pada Tumbuhan Ternyata Miliki Peran Penting ",Citizen6,2
"Top 3: Taruh Tisu Basah dalam Mesin Cuci Serat dan Bulu di Pakaian Hilang ",Citizen6,2
"Tata Cara Sholat Dhuha Dilengkapi Bacaan Niat dan Doa serta Manfaat Menakjubkannya ",Citizen6,2
"12 Tafsir Mimpi Bertemu Ular Menurut Islam Pertanda Baik hingga Buruk ",Citizen6,2
"Tata Cara Sholat Istisqa Lengkap dengan Niat dan Doanya Meminta Hujan Saat Musim Kemarau Berkepanjangan ",Citizen6,2
"Tata Cara Sholat Istisqa Lengkap dengan Niat dan Doanya Meminta Hujan Saat Musim Kemarau Berkepanjangan ",Citizen6,2
"Jangan Takut Ketahui Arti Mimpi Kecelakaan Mobil ",Citizen6,2
"Bacaan Doa Istighosah Lengkap dengan Artinya untuk Meminta Pertolongan Allah SWT ",Citizen6,2
"4 Arti Mimpi Darah Haid Pertanda Kejadian Tak Terduga akan Datang ",Citizen6,2
"Cerita Asal Mula Pohon Natal ",Global,2
"Makna di Balik 6 Simbol Jari di Sejumlah Negara ",Global,2
"Jadi Hijau dan Kental Ini 7 Tanda Perubahan Warna Ingus Saat Pilek ",Global,2
"Mitos Kupu-Kupu Hinggap di Badan Tanda Hadirnya Malaikat hingga Arwah Seseorang ",Global,2
"KTT Non-Blok XII Melahirkan Deklarasi Kuala Lumpur ",Global,2
"Makna Setiap Kegiatan dalam Tata Upacara Pernikahan Adat Jawa ",Health,2
"Makna Setiap Kegiatan dalam Tata Upacara Pernikahan Adat Jawa ",Health,2
"Ini Batas Makanan Masih Bisa Dikonsumsi Setelah Kedaluwarsa ",Health,2
"Fungsi Darah Pada Manusia dan Jenis-jenis Sel Darah yang Wajib Kamu Tahu ",Health,2
"Mimpi Bercinta dengan Sesama Jenis Apa Artinya? ",Health,2
"10 Titik Sentuhan Agar Wanita 'Melayang-layang' ",Health,2
"Fungsi Ijtihad Sebagai Sumber Hukum Islam Beserta Jenis dan Contohnya ",Hot,2
"10 Obat Tradisional Penyakit Kuning yang Ampuh Gunakan Bahan Alami ",Hot,2
"Tata Cara Mengurus Jenazah dari Memandikan Sampai Menguburkan dalam Islam ",Hot,2
"8 Cara Mencegah Korosi Ketahui Penyebabnya ",Hot,2
"4 Jenis-Jenis BIOS yang Sering Digunakan dan Ketahui Fungsinya ",Hot,2
"6 Manfaat Gunung Berapi bagi Kehidupan Manusia Jaga Kelestariannya ",Hot,2
"7 Minuman Diuretik Alami Ketahui Kapan Harus Mengonsumsinya ",Hot,2
"Contoh Kata Sambutan yang Baik dan Benar dalam Berbagai Acara ",Hot,2
"375 Nama Bayi Sansekerta Laki-laki dan Perempuan yang Indah ",Hot,2
"150 Contoh Kata Sifat dalam Bahasa Inggris dan Artinya dalam Bahasa Indonesia ",Hot,2
"7 Biodata Member BTS dan Fakta Menariknya Army Wajib Tahu ",Hot,2
"20 Makanan Khas Suku Minangkabau Dominasi Rasa Pedas dan Kaya Rempah ",Hot,2
"8 Unsur-unsur Seni Rupa Wajib Tahu dan Jangan Sampai Tertukar ",Hot,2
"Pengertian Haji dan Umrah Hukum Rukun Serta Waktu Pelaksanannya ",Hot,2
"40 Makanan Khas Daerah di Indonesia Beserta Asalnya Wajib Dicicipi ",Hot,2
